i18next::backendConnector: loaded namespace common for language es {navigation: {…}, actions: {…}, forms: {…}, messages: {…}, dashboard: {…}}
eruda.js:2 i18next: languageChanged es
eruda.js:2 i18next: initialized {debug: true, initAsync: true, ns: Array(1), defaultNS: 'common', fallbackLng: Array(1), …}
eruda.js:2 🌐 [QUERY] GET /api/parks/99/extended
eruda.js:2 🌐 [SAFE API] GET /api/parks/99/evaluation-stats
eruda.js:2 Respuesta del servidor: {user: {…}, token: 'direct-token-1757020624466'}
eruda.js:2 🌐 [QUERY] GET /api/parks
eruda.js:2 🌐 [QUERY] GET /api/activities
eruda.js:2 🌐 [QUERY] GET /api/users
eruda.js:2 🌐 [QUERY] GET /api/hr/employees
eruda.js:2 🌐 [QUERY] GET /api/volunteers
eruda.js:2 🌐 [QUERY] GET /api/active-concessions
eruda.js:2 🌐 [QUERY] GET /api/actividades-fotos
eruda.js:2 🌐 [QUERY] GET /api/activity-categories
eruda.js:2 Warning: Missing `Description` or `aria-describedby={undefined}` for {DialogContent}.
Mt.forEach.n.<computed> @ Console.js:61
(anonymous) @ chunk-PZOYHTW2.js?v=a5b62361:339
commitHookEffectListMount @ chunk-SKRUXVEK.js?v=a5b62361:16915
commitPassiveMountOnFiber @ chunk-SKRUXVEK.js?v=a5b62361:18156
commitPassiveMountEffects_complete @ chunk-SKRUXVEK.js?v=a5b62361:18129
commitPassiveMountEffects_begin @ chunk-SKRUXVEK.js?v=a5b62361:18119
commitPassiveMountEffects @ chunk-SKRUXVEK.js?v=a5b62361:18109
flushPassiveEffectsImpl @ chunk-SKRUXVEK.js?v=a5b62361:19490
flushPassiveEffects @ chunk-SKRUXVEK.js?v=a5b62361:19447
commitRootImpl @ chunk-SKRUXVEK.js?v=a5b62361:19416
commitRoot @ chunk-SKRUXVEK.js?v=a5b62361:19277
performSyncWorkOnRoot @ chunk-SKRUXVEK.js?v=a5b62361:18895
flushSyncCallbacks @ chunk-SKRUXVEK.js?v=a5b62361:9119
(anonymous) @ chunk-SKRUXVEK.js?v=a5b62361:18627Understand this warning
eruda.js:2 [vite] server connection lost. Polling for restart...
workspace_iframe.html?initialPath=%2Fparque%2Fbosque-los-colomos-99&id=%3Ar2bf%3A:151  GET https://4db9107a-1fd2-47c3-aace-3499f16eb526-00-uaauleor3l7s.spock.replit.dev/parque/bosque-los-colomos-99 404 (Not Found)
(anonymous) @ workspace_iframe.html?initialPath=%2Fparque%2Fbosque-los-colomos-99&id=%3Ar2bf%3A:151Understand this error
workspace_iframe.html?initialPath=%2Fparque%2Fbosque-los-colomos-99&id=%3Ar2bf%3A:151  GET https://4db9107a-1fd2-47c3-aace-3499f16eb526-00-uaauleor3l7s.spock.replit.dev/parque/bosque-los-colomos-99 404 (Not Found)
(anonymous) @ workspace_iframe.htm…9&id=%3Ar2bf%3A:151Understand this error
4db9107a-1fd2-47c3-aace-3499f16eb526-00-uaauleor3l7s.spock.replit.dev/__replco/workspace_iframe.html?initialPath=%2Fparque%2Fbosque-los-colomos-99&id=%3Ar2bf%3A:151  GET https://4db9107a-1fd2-47c3-aace-3499f16eb526-00-uaauleor3l7s.spock.replit.dev/parque/bosque-los-colomos-99 404 (Not Found)
(anonymous) @ 4db9107a-1fd2-47c3-a…9&id=%3Ar2bf%3A:151Understand this error
workspace_iframe.html?initialPath=%2Fadmin%2Froles&id=%3Ar2bf%3A:151  GET https://4db9107a-1fd2-47c3-aace-3499f16eb526-00-uaauleor3l7s.spock.replit.dev/admin/roles 404 (Not Found)
(anonymous) @ workspace_iframe.html?initialPath=%2Fadmin%2Froles&id=%3Ar2bf%3A:151Understand this error
workspace_iframe.html?initialPath=%2Fadmin%2Froles&id=%3Ar2bf%3A:151  GET https://4db9107a-1fd2-47c3-aace-3499f16eb526-00-uaauleor3l7s.spock.replit.dev/admin/roles 404 (Not Found)
(anonymous) @ workspace_iframe.htm…s&id=%3Ar2bf%3A:151Understand this error
eruda.js:2 Google Maps JavaScript API has been loaded directly without loading=async. This can result in suboptimal performance. For best-practice loading patterns please see https://goo.gle/js-api-loading
Mt.forEach.n.<computed> @ Console.js:61
cda @ js?key=AIzaSyDaqAAzVMAp-8OSbeOhV5pzwIo7cX509Io&libraries=places:1413
google.maps.Load @ js?key=AIzaSyDaqAAzVMAp-8OSbeOhV5pzwIo7cX509Io&libraries=places:14
(anonymous) @ js?key=AIzaSyDaqAAzVMAp-8OSbeOhV5pzwIo7cX509Io&libraries=places:1683
(anonymous) @ js?key=AIzaSyDaqAAzVMAp-8OSbeOhV5pzwIo7cX509Io&libraries=places:1683Understand this warning
eruda.js:2 i18next::backendConnector: loaded namespace common for language es {navigation: {…}, actions: {…}, forms: {…}, messages: {…}, dashboard: {…}}
eruda.js:2 i18next: languageChanged es
eruda.js:2 i18next: initialized {debug: true, initAsync: true, ns: Array(1), defaultNS: 'common', fallbackLng: Array(1), …}
eruda.js:2 🌐 [QUERY] GET /api/roles
eruda.js:2 🌐 [QUERY] GET /api/users/permissions
eruda.js:2 🌐 [QUERY] GET /api/users/all-with-multiple-roles
eruda.js:2 🌐 [QUERY] GET /api/users-with-roles
eruda.js:2  GET https://4db9107a-1fd2-47c3-aace-3499f16eb526-00-uaauleor3l7s.spock.replit.dev/api/users/all-with-multiple-roles 404 (Not Found)
window.fetch @ Network.js:219
apply @ injected.js:253
(anonymous) @ queryClient.ts:213
fetchFn @ @tanstack_react-query.js?v=a5b62361:850
run @ @tanstack_react-query.js?v=a5b62361:500
start @ @tanstack_react-query.js?v=a5b62361:542
fetch @ @tanstack_react-query.js?v=a5b62361:937
executeFetch_fn @ @tanstack_react-query.js?v=a5b62361:2244
onSubscribe @ @tanstack_react-query.js?v=a5b62361:1948
subscribe @ @tanstack_react-query.js?v=a5b62361:24
(anonymous) @ @tanstack_react-query.js?v=a5b62361:3093
subscribeToStore @ chunk-SKRUXVEK.js?v=a5b62361:11984
commitHookEffectListMount @ chunk-SKRUXVEK.js?v=a5b62361:16915
commitPassiveMountOnFiber @ chunk-SKRUXVEK.js?v=a5b62361:18156
commitPassiveMountEffects_complete @ chunk-SKRUXVEK.js?v=a5b62361:18129
commitPassiveMountEffects_begin @ chunk-SKRUXVEK.js?v=a5b62361:18119
commitPassiveMountEffects @ chunk-SKRUXVEK.js?v=a5b62361:18109
flushPassiveEffectsImpl @ chunk-SKRUXVEK.js?v=a5b62361:19490
flushPassiveEffects @ chunk-SKRUXVEK.js?v=a5b62361:19447
performSyncWorkOnRoot @ chunk-SKRUXVEK.js?v=a5b62361:18868
flushSyncCallbacks @ chunk-SKRUXVEK.js?v=a5b62361:9119
commitRootImpl @ chunk-SKRUXVEK.js?v=a5b62361:19432
commitRoot @ chunk-SKRUXVEK.js?v=a5b62361:19277
finishConcurrentRender @ chunk-SKRUXVEK.js?v=a5b62361:18805
performConcurrentWorkOnRoot @ chunk-SKRUXVEK.js?v=a5b62361:18718
workLoop @ chunk-SKRUXVEK.js?v=a5b62361:197
flushWork @ chunk-SKRUXVEK.js?v=a5b62361:176
performWorkUntilDeadline @ chunk-SKRUXVEK.js?v=a5b62361:384Understand this error
eruda.js:2 Query failed for: /api/users/all-with-multiple-roles Error: Usuario no encontrado
    at queryClient.ts:172:13
Mt.forEach.n.<computed> @ Console.js:61
(anonymous) @ queryClient.ts:241
await in (anonymous)
fetchFn @ @tanstack_react-query.js?v=a5b62361:850
run @ @tanstack_react-query.js?v=a5b62361:500
start @ @tanstack_react-query.js?v=a5b62361:542
fetch @ @tanstack_react-query.js?v=a5b62361:937
executeFetch_fn @ @tanstack_react-query.js?v=a5b62361:2244
onSubscribe @ @tanstack_react-query.js?v=a5b62361:1948
subscribe @ @tanstack_react-query.js?v=a5b62361:24
(anonymous) @ @tanstack_react-query.js?v=a5b62361:3093
subscribeToStore @ chunk-SKRUXVEK.js?v=a5b62361:11984
commitHookEffectListMount @ chunk-SKRUXVEK.js?v=a5b62361:16915
commitPassiveMountOnFiber @ chunk-SKRUXVEK.js?v=a5b62361:18156
commitPassiveMountEffects_complete @ chunk-SKRUXVEK.js?v=a5b62361:18129
commitPassiveMountEffects_begin @ chunk-SKRUXVEK.js?v=a5b62361:18119
commitPassiveMountEffects @ chunk-SKRUXVEK.js?v=a5b62361:18109
flushPassiveEffectsImpl @ chunk-SKRUXVEK.js?v=a5b62361:19490
flushPassiveEffects @ chunk-SKRUXVEK.js?v=a5b62361:19447
performSyncWorkOnRoot @ chunk-SKRUXVEK.js?v=a5b62361:18868
flushSyncCallbacks @ chunk-SKRUXVEK.js?v=a5b62361:9119
commitRootImpl @ chunk-SKRUXVEK.js?v=a5b62361:19432
commitRoot @ chunk-SKRUXVEK.js?v=a5b62361:19277
finishConcurrentRender @ chunk-SKRUXVEK.js?v=a5b62361:18805
performConcurrentWorkOnRoot @ chunk-SKRUXVEK.js?v=a5b62361:18718
workLoop @ chunk-SKRUXVEK.js?v=a5b62361:197
flushWork @ chunk-SKRUXVEK.js?v=a5b62361:176
performWorkUntilDeadline @ chunk-SKRUXVEK.js?v=a5b62361:384Understand this error
eruda.js:2  GET https://4db9107a-1fd2-47c3-aace-3499f16eb526-00-uaauleor3l7s.spock.replit.dev/api/users/permissions 404 (Not Found)
window.fetch @ Network.js:219
apply @ injected.js:253
(anonymous) @ queryClient.ts:213
fetchFn @ @tanstack_react-query.js?v=a5b62361:850
run @ @tanstack_react-query.js?v=a5b62361:500
start @ @tanstack_react-query.js?v=a5b62361:542
fetch @ @tanstack_react-query.js?v=a5b62361:937
executeFetch_fn @ @tanstack_react-query.js?v=a5b62361:2244
onSubscribe @ @tanstack_react-query.js?v=a5b62361:1948
subscribe @ @tanstack_react-query.js?v=a5b62361:24
(anonymous) @ @tanstack_react-query.js?v=a5b62361:3093
subscribeToStore @ chunk-SKRUXVEK.js?v=a5b62361:11984
commitHookEffectListMount @ chunk-SKRUXVEK.js?v=a5b62361:16915
commitPassiveMountOnFiber @ chunk-SKRUXVEK.js?v=a5b62361:18156
commitPassiveMountEffects_complete @ chunk-SKRUXVEK.js?v=a5b62361:18129
commitPassiveMountEffects_begin @ chunk-SKRUXVEK.js?v=a5b62361:18119
commitPassiveMountEffects @ chunk-SKRUXVEK.js?v=a5b62361:18109
flushPassiveEffectsImpl @ chunk-SKRUXVEK.js?v=a5b62361:19490
flushPassiveEffects @ chunk-SKRUXVEK.js?v=a5b62361:19447
performSyncWorkOnRoot @ chunk-SKRUXVEK.js?v=a5b62361:18868
flushSyncCallbacks @ chunk-SKRUXVEK.js?v=a5b62361:9119
commitRootImpl @ chunk-SKRUXVEK.js?v=a5b62361:19432
commitRoot @ chunk-SKRUXVEK.js?v=a5b62361:19277
finishConcurrentRender @ chunk-SKRUXVEK.js?v=a5b62361:18805
performConcurrentWorkOnRoot @ chunk-SKRUXVEK.js?v=a5b62361:18718
workLoop @ chunk-SKRUXVEK.js?v=a5b62361:197
flushWork @ chunk-SKRUXVEK.js?v=a5b62361:176
performWorkUntilDeadline @ chunk-SKRUXVEK.js?v=a5b62361:384Understand this error
eruda.js:2 Query failed for: /api/users/permissions Error: Usuario no encontrado
    at queryClient.ts:172:13
Mt.forEach.n.<computed> @ Console.js:61
(anonymous) @ queryClient.ts:241
await in (anonymous)
fetchFn @ @tanstack_react-query.js?v=a5b62361:850
run @ @tanstack_react-query.js?v=a5b62361:500
start @ @tanstack_react-query.js?v=a5b62361:542
fetch @ @tanstack_react-query.js?v=a5b62361:937
executeFetch_fn @ @tanstack_react-query.js?v=a5b62361:2244
onSubscribe @ @tanstack_react-query.js?v=a5b62361:1948
subscribe @ @tanstack_react-query.js?v=a5b62361:24
(anonymous) @ @tanstack_react-query.js?v=a5b62361:3093
subscribeToStore @ chunk-SKRUXVEK.js?v=a5b62361:11984
commitHookEffectListMount @ chunk-SKRUXVEK.js?v=a5b62361:16915
commitPassiveMountOnFiber @ chunk-SKRUXVEK.js?v=a5b62361:18156
commitPassiveMountEffects_complete @ chunk-SKRUXVEK.js?v=a5b62361:18129
commitPassiveMountEffects_begin @ chunk-SKRUXVEK.js?v=a5b62361:18119
commitPassiveMountEffects @ chunk-SKRUXVEK.js?v=a5b62361:18109
flushPassiveEffectsImpl @ chunk-SKRUXVEK.js?v=a5b62361:19490
flushPassiveEffects @ chunk-SKRUXVEK.js?v=a5b62361:19447
performSyncWorkOnRoot @ chunk-SKRUXVEK.js?v=a5b62361:18868
flushSyncCallbacks @ chunk-SKRUXVEK.js?v=a5b62361:9119
commitRootImpl @ chunk-SKRUXVEK.js?v=a5b62361:19432
commitRoot @ chunk-SKRUXVEK.js?v=a5b62361:19277
finishConcurrentRender @ chunk-SKRUXVEK.js?v=a5b62361:18805
performConcurrentWorkOnRoot @ chunk-SKRUXVEK.js?v=a5b62361:18718
workLoop @ chunk-SKRUXVEK.js?v=a5b62361:197
flushWork @ chunk-SKRUXVEK.js?v=a5b62361:176
performWorkUntilDeadline @ chunk-SKRUXVEK.js?v=a5b62361:384Understand this error
eruda.js:2 🌐 [QUERY] GET /api/activities
eruda.js:2 🌐 [QUERY] GET /api/actividades-fotos
eruda.js:2 🌐 [QUERY] GET /api/parks
eruda.js:2 🌐 [QUERY] GET /api/activity-categories
eruda.js:2 Warning: Missing `Description` or `aria-describedby={undefined}` for {DialogContent}.
Mt.forEach.n.<computed> @ Console.js:61
(anonymous) @ chunk-PZOYHTW2.js?v=a5b62361:339
commitHookEffectListMount @ chunk-SKRUXVEK.js?v=a5b62361:16915
commitPassiveMountOnFiber @ chunk-SKRUXVEK.js?v=a5b62361:18156
commitPassiveMountEffects_complete @ chunk-SKRUXVEK.js?v=a5b62361:18129
commitPassiveMountEffects_begin @ chunk-SKRUXVEK.js?v=a5b62361:18119
commitPassiveMountEffects @ chunk-SKRUXVEK.js?v=a5b62361:18109
flushPassiveEffectsImpl @ chunk-SKRUXVEK.js?v=a5b62361:19490
flushPassiveEffects @ chunk-SKRUXVEK.js?v=a5b62361:19447
commitRootImpl @ chunk-SKRUXVEK.js?v=a5b62361:19416
commitRoot @ chunk-SKRUXVEK.js?v=a5b62361:19277
performSyncWorkOnRoot @ chunk-SKRUXVEK.js?v=a5b62361:18895
flushSyncCallbacks @ chunk-SKRUXVEK.js?v=a5b62361:9119
(anonymous) @ chunk-SKRUXVEK.js?v=a5b62361:18627Understand this warning
eruda.js:2 🚀 INICIANDO IMPORTACIÓN CSV
eruda.js:2 📁 Archivo seleccionado: Actividades Final.csv 11400 bytes
eruda.js:2 📄 Contenido del archivo CSV (primeros 500 caracteres): título,descripción,parque,categoría,fechaInicio,fechaFin,horaInicio,horaFin,ubicación,latitud,longitud,capacidad,duración,precio,esGratis,materiales,requisitos,esRecurrente,diasRecurrentes,mercadoObjetivo,necesidadesEspeciales,permiteRegistroPublico,maxRegistros,fechaLimiteRegistro,instruccionesRegistro,requiereAprobacion,restriccionesEdad,requisitosSalud
Cine al aire libre,Cine al aire libre con películas familiares proyectadas en pantallas gigantes.,Parque Ecológico Explora,Arte y Cultura,15/
eruda.js:2 📋 Headers encontrados: (28) ['título', 'descripción', 'parque', 'categoría', 'fechaInicio', 'fechaFin', 'horaInicio', 'horaFin', 'ubicación', 'latitud', 'longitud', 'capacidad', 'duración', 'precio', 'esGratis', 'materiales', 'requisitos', 'esRecurrente', 'diasRecurrentes', 'mercadoObjetivo', 'necesidadesEspeciales', 'permiteRegistroPublico', 'maxRegistros', 'fechaLimiteRegistro', 'instruccionesRegistro', 'requiereAprobacion', 'restriccionesEdad', 'requisitosSalud']
eruda.js:2 📊 Total de columnas en header: 28
eruda.js:2 📝 Procesando fila 2: 28 valores: (28) ['Cine al aire libre', 'Cine al aire libre con películas familiares proyectadas en pantallas gigantes.', 'Parque Ecológico Explora', 'Arte y Cultura', '15/09/25', '15/09/25', '8:00', '9:30', 'Explanada Verde', '21.1215', '-101.682', '30', '120', '0', 'Si', 'Pantalla inflable, proyector de alta potencia, sistema de sonido portátil, sillas plegables', 'Asistir con manta o silla portátil, permitido ingreso con snacks personales', 'Sí', '', 'Adultos', 'principiantes', 'Sí', '25', '10/03/24', 'Contactar por email para registro', 'No', '16+', 'Sin problemas cardíacos']
eruda.js:2 ✅ Valores ajustados (28): (28) ['Cine al aire libre', 'Cine al aire libre con películas familiares proyectadas en pantallas gigantes.', 'Parque Ecológico Explora', 'Arte y Cultura', '15/09/25', '15/09/25', '8:00', '9:30', 'Explanada Verde', '21.1215', '-101.682', '30', '120', '0', 'Si', 'Pantalla inflable, proyector de alta potencia, sistema de sonido portátil, sillas plegables', 'Asistir con manta o silla portátil, permitido ingreso con snacks personales', 'Sí', '', 'Adultos', 'principiantes', 'Sí', '25', '10/03/24', 'Contactar por email para registro', 'No', '16+', 'Sin problemas cardíacos']
eruda.js:2 🔍 Mapeando header: "título" -> "título" = "Cine al aire libre"
eruda.js:2 🔍 Mapeando header: "descripción" -> "descripción" = "Cine al aire libre con películas familiares proyectadas en pantallas gigantes."
eruda.js:2 🔍 Mapeando header: "parque" -> "parque" = "Parque Ecológico Explora"
eruda.js:2 🏞️ Buscando parque: "Parque Ecológico Explora"
eruda.js:2 🏞️ Parques disponibles: (19) ['Bosque Los Colomos', 'Bosque de Chapultepec', 'Gran Parque La Plancha', 'Jardín Botánico de Culiacán', 'Parque Bicentenario', 'Parque Central Ciudad Juárez', 'Parque Cultural Higalguense', 'Parque Ecológico Explora', 'Parque Flor del Bosque', 'Parque Fundidora', 'Parque Guanajuato Bicentenario', 'Parque La Mexicana', 'Parque Las Ribieras', 'Parque Metropolitano de Guadalajara', 'Parque Metropolitano de León', 'Parque Rufino Tamayo', 'Parque Tangamanga I', 'Parque el Capitán', 'Sin especificar']
eruda.js:2 ✅ Parque encontrado: Parque Ecológico Explora (ID: 86)
eruda.js:2 🔍 Mapeando header: "categoría" -> "categoría" = "Arte y Cultura"
eruda.js:2 🎨 Buscando categoría: "Arte y Cultura"
eruda.js:2 🎨 Categorías disponibles: (5) ['Arte y Cultura', 'Naturaleza y Ciencia', 'Deportes y Recreación', 'Comunidad', 'Eventos de Temporada']
eruda.js:2 ✅ Categoría encontrada: Arte y Cultura (ID: 1)
eruda.js:2 🔍 Mapeando header: "fechaInicio" -> "fechainicio" = "15/09/25"
eruda.js:2 📅 Fecha inicio convertida: "15/09/25" -> "2025-09-15T00:00:00.000Z"
eruda.js:2 🔍 Mapeando header: "fechaFin" -> "fechafin" = "15/09/25"
eruda.js:2 📅 Fecha fin convertida: "15/09/25" -> "2025-09-15T00:00:00.000Z"
eruda.js:2 🔍 Mapeando header: "horaInicio" -> "horainicio" = "8:00"
eruda.js:2 🔍 Mapeando header: "horaFin" -> "horafin" = "9:30"
eruda.js:2 🔍 Mapeando header: "ubicación" -> "ubicación" = "Explanada Verde"
eruda.js:2 🔍 Mapeando header: "latitud" -> "latitud" = "21.1215"
eruda.js:2 🔍 Mapeando header: "longitud" -> "longitud" = "-101.682"
eruda.js:2 🔍 Mapeando header: "capacidad" -> "capacidad" = "30"
eruda.js:2 🔍 Mapeando header: "duración" -> "duración" = "120"
eruda.js:2 🔍 Mapeando header: "precio" -> "precio" = "0"
eruda.js:2 🔍 Mapeando header: "esGratis" -> "esgratis" = "Si"
eruda.js:2 💰 Procesando campo gratis: "Si"
eruda.js:2 💰 Es gratis: true
eruda.js:2 🔍 Mapeando header: "materiales" -> "materiales" = "Pantalla inflable, proyector de alta potencia, sistema de sonido portátil, sillas plegables"
eruda.js:2 🔍 Mapeando header: "requisitos" -> "requisitos" = "Asistir con manta o silla portátil, permitido ingreso con snacks personales"
eruda.js:2 🔍 Mapeando header: "esRecurrente" -> "esrecurrente" = "Sí"
eruda.js:2 🔍 Mapeando header: "diasRecurrentes" -> "diasrecurrentes" = ""
eruda.js:2 🔍 Mapeando header: "mercadoObjetivo" -> "mercadoobjetivo" = "Adultos"
eruda.js:2 🎯 Mercado objetivo: ["Adultos"]
eruda.js:2 🔍 Mapeando header: "necesidadesEspeciales" -> "necesidadesespeciales" = "principiantes"
eruda.js:2 ♿ Necesidades especiales: ["principiantes"]
eruda.js:2 🔍 Mapeando header: "permiteRegistroPublico" -> "permiteregistropublico" = "Sí"
eruda.js:2 🔍 Mapeando header: "maxRegistros" -> "maxregistros" = "25"
eruda.js:2 🔍 Mapeando header: "fechaLimiteRegistro" -> "fechalimiteregistro" = "10/03/24"
eruda.js:2 🔍 Mapeando header: "instruccionesRegistro" -> "instruccionesregistro" = "Contactar por email para registro"
eruda.js:2 🔍 Mapeando header: "requiereAprobacion" -> "requiereaprobacion" = "No"
eruda.js:2 🔍 Mapeando header: "restriccionesEdad" -> "restriccionesedad" = "16+"
eruda.js:2 🔍 Mapeando header: "requisitosSalud" -> "requisitossalud" = "Sin problemas cardíacos"
eruda.js:2 📝 Procesando fila 3: 28 valores: (28) ['Talleres de pintura o escultura', 'Talleres de pintura o escultura para fomentar creatividad y expresión artística.', 'Parque Fundidora', 'Arte y Cultura', '16/09/25', '16/09/25', '8:00', '9:30', 'Pabellón Creativo', '25.675', '-100.286', '100', '90', '150', 'No', 'Caballetes, pinceles, pinturas acrílicas, arcilla, mesas de trabajo', 'Edad mínima ocho años, inscripción previa, uso obligatorio de mandil y materiales básicos', 'Si', '', 'Niños', '', '', '', '', '', '', '', '']
eruda.js:2 ✅ Valores ajustados (28): (28) ['Talleres de pintura o escultura', 'Talleres de pintura o escultura para fomentar creatividad y expresión artística.', 'Parque Fundidora', 'Arte y Cultura', '16/09/25', '16/09/25', '8:00', '9:30', 'Pabellón Creativo', '25.675', '-100.286', '100', '90', '150', 'No', 'Caballetes, pinceles, pinturas acrílicas, arcilla, mesas de trabajo', 'Edad mínima ocho años, inscripción previa, uso obligatorio de mandil y materiales básicos', 'Si', '', 'Niños', '', '', '', '', '', '', '', '']
eruda.js:2 🔍 Mapeando header: "título" -> "título" = "Talleres de pintura o escultura"
eruda.js:2 🔍 Mapeando header: "descripción" -> "descripción" = "Talleres de pintura o escultura para fomentar creatividad y expresión artística."
eruda.js:2 🔍 Mapeando header: "parque" -> "parque" = "Parque Fundidora"
eruda.js:2 🏞️ Buscando parque: "Parque Fundidora"
eruda.js:2 🏞️ Parques disponibles: (19) ['Bosque Los Colomos', 'Bosque de Chapultepec', 'Gran Parque La Plancha', 'Jardín Botánico de Culiacán', 'Parque Bicentenario', 'Parque Central Ciudad Juárez', 'Parque Cultural Higalguense', 'Parque Ecológico Explora', 'Parque Flor del Bosque', 'Parque Fundidora', 'Parque Guanajuato Bicentenario', 'Parque La Mexicana', 'Parque Las Ribieras', 'Parque Metropolitano de Guadalajara', 'Parque Metropolitano de León', 'Parque Rufino Tamayo', 'Parque Tangamanga I', 'Parque el Capitán', 'Sin especificar']
eruda.js:2 ✅ Parque encontrado: Parque Fundidora (ID: 94)
eruda.js:2 🔍 Mapeando header: "categoría" -> "categoría" = "Arte y Cultura"
eruda.js:2 🎨 Buscando categoría: "Arte y Cultura"
eruda.js:2 🎨 Categorías disponibles: (5) ['Arte y Cultura', 'Naturaleza y Ciencia', 'Deportes y Recreación', 'Comunidad', 'Eventos de Temporada']
eruda.js:2 ✅ Categoría encontrada: Arte y Cultura (ID: 1)
eruda.js:2 🔍 Mapeando header: "fechaInicio" -> "fechainicio" = "16/09/25"
eruda.js:2 📅 Fecha inicio convertida: "16/09/25" -> "2025-09-16T00:00:00.000Z"
eruda.js:2 🔍 Mapeando header: "fechaFin" -> "fechafin" = "16/09/25"
eruda.js:2 📅 Fecha fin convertida: "16/09/25" -> "2025-09-16T00:00:00.000Z"
eruda.js:2 🔍 Mapeando header: "horaInicio" -> "horainicio" = "8:00"
eruda.js:2 🔍 Mapeando header: "horaFin" -> "horafin" = "9:30"
eruda.js:2 🔍 Mapeando header: "ubicación" -> "ubicación" = "Pabellón Creativo"
eruda.js:2 🔍 Mapeando header: "latitud" -> "latitud" = "25.675"
eruda.js:2 🔍 Mapeando header: "longitud" -> "longitud" = "-100.286"
eruda.js:2 🔍 Mapeando header: "capacidad" -> "capacidad" = "100"
eruda.js:2 🔍 Mapeando header: "duración" -> "duración" = "90"
eruda.js:2 🔍 Mapeando header: "precio" -> "precio" = "150"
eruda.js:2 🔍 Mapeando header: "esGratis" -> "esgratis" = "No"
eruda.js:2 💰 Procesando campo gratis: "No"
eruda.js:2 💰 Es gratis: false
eruda.js:2 🔍 Mapeando header: "materiales" -> "materiales" = "Caballetes, pinceles, pinturas acrílicas, arcilla, mesas de trabajo"
eruda.js:2 🔍 Mapeando header: "requisitos" -> "requisitos" = "Edad mínima ocho años, inscripción previa, uso obligatorio de mandil y materiales básicos"
eruda.js:2 🔍 Mapeando header: "esRecurrente" -> "esrecurrente" = "Si"
eruda.js:2 🔍 Mapeando header: "diasRecurrentes" -> "diasrecurrentes" = ""
eruda.js:2 🔍 Mapeando header: "mercadoObjetivo" -> "mercadoobjetivo" = "Niños"
eruda.js:2 🎯 Mercado objetivo: ["Niños"]
eruda.js:2 🔍 Mapeando header: "necesidadesEspeciales" -> "necesidadesespeciales" = ""
eruda.js:2 🔍 Mapeando header: "permiteRegistroPublico" -> "permiteregistropublico" = ""
eruda.js:2 🔍 Mapeando header: "maxRegistros" -> "maxregistros" = ""
eruda.js:2 🔍 Mapeando header: "fechaLimiteRegistro" -> "fechalimiteregistro" = ""
eruda.js:2 🔍 Mapeando header: "instruccionesRegistro" -> "instruccionesregistro" = ""
eruda.js:2 🔍 Mapeando header: "requiereAprobacion" -> "requiereaprobacion" = ""
eruda.js:2 🔍 Mapeando header: "restriccionesEdad" -> "restriccionesedad" = ""
eruda.js:2 🔍 Mapeando header: "requisitosSalud" -> "requisitossalud" = ""
eruda.js:2 📝 Procesando fila 4: 28 valores: (28) ['Clases de música o presentaciones en vivo', 'Clases de música o presentaciones en vivo con artistas locales invitados.', 'Bosque de Chapultepec', 'Arte y Cultura', '17/09/25', '17/09/25', '8:00', '9:30', 'Foro Cultural', '19.4204', '-99.1819', '20', '60', '0', 'Si', 'Micrófonos, guitarras, teclados, bocinas profesionales, tarima pequeña', 'Participación abierta, registro en línea, traer instrumento propio si se desea', 'No', '', 'Adolescentes', '', '', '', '', '', '', '', '']
eruda.js:2 ✅ Valores ajustados (28): (28) ['Clases de música o presentaciones en vivo', 'Clases de música o presentaciones en vivo con artistas locales invitados.', 'Bosque de Chapultepec', 'Arte y Cultura', '17/09/25', '17/09/25', '8:00', '9:30', 'Foro Cultural', '19.4204', '-99.1819', '20', '60', '0', 'Si', 'Micrófonos, guitarras, teclados, bocinas profesionales, tarima pequeña', 'Participación abierta, registro en línea, traer instrumento propio si se desea', 'No', '', 'Adolescentes', '', '', '', '', '', '', '', '']
eruda.js:2 🔍 Mapeando header: "título" -> "título" = "Clases de música o presentaciones en vivo"
eruda.js:2 🔍 Mapeando header: "descripción" -> "descripción" = "Clases de música o presentaciones en vivo con artistas locales invitados."
eruda.js:2 🔍 Mapeando header: "parque" -> "parque" = "Bosque de Chapultepec"
eruda.js:2 🏞️ Buscando parque: "Bosque de Chapultepec"
eruda.js:2 🏞️ Parques disponibles: (19) ['Bosque Los Colomos', 'Bosque de Chapultepec', 'Gran Parque La Plancha', 'Jardín Botánico de Culiacán', 'Parque Bicentenario', 'Parque Central Ciudad Juárez', 'Parque Cultural Higalguense', 'Parque Ecológico Explora', 'Parque Flor del Bosque', 'Parque Fundidora', 'Parque Guanajuato Bicentenario', 'Parque La Mexicana', 'Parque Las Ribieras', 'Parque Metropolitano de Guadalajara', 'Parque Metropolitano de León', 'Parque Rufino Tamayo', 'Parque Tangamanga I', 'Parque el Capitán', 'Sin especificar']
eruda.js:2 ✅ Parque encontrado: Bosque de Chapultepec (ID: 90)
eruda.js:2 🔍 Mapeando header: "categoría" -> "categoría" = "Arte y Cultura"
eruda.js:2 🎨 Buscando categoría: "Arte y Cultura"
eruda.js:2 🎨 Categorías disponibles: (5) ['Arte y Cultura', 'Naturaleza y Ciencia', 'Deportes y Recreación', 'Comunidad', 'Eventos de Temporada']
eruda.js:2 ✅ Categoría encontrada: Arte y Cultura (ID: 1)
eruda.js:2 🔍 Mapeando header: "fechaInicio" -> "fechainicio" = "17/09/25"
eruda.js:2 📅 Fecha inicio convertida: "17/09/25" -> "2025-09-17T00:00:00.000Z"
eruda.js:2 🔍 Mapeando header: "fechaFin" -> "fechafin" = "17/09/25"
eruda.js:2 📅 Fecha fin convertida: "17/09/25" -> "2025-09-17T00:00:00.000Z"
eruda.js:2 🔍 Mapeando header: "horaInicio" -> "horainicio" = "8:00"
eruda.js:2 🔍 Mapeando header: "horaFin" -> "horafin" = "9:30"
eruda.js:2 🔍 Mapeando header: "ubicación" -> "ubicación" = "Foro Cultural"
eruda.js:2 🔍 Mapeando header: "latitud" -> "latitud" = "19.4204"
eruda.js:2 🔍 Mapeando header: "longitud" -> "longitud" = "-99.1819"
eruda.js:2 🔍 Mapeando header: "capacidad" -> "capacidad" = "20"
eruda.js:2 🔍 Mapeando header: "duración" -> "duración" = "60"
eruda.js:2 🔍 Mapeando header: "precio" -> "precio" = "0"
eruda.js:2 🔍 Mapeando header: "esGratis" -> "esgratis" = "Si"
eruda.js:2 💰 Procesando campo gratis: "Si"
eruda.js:2 💰 Es gratis: true
eruda.js:2 🔍 Mapeando header: "materiales" -> "materiales" = "Micrófonos, guitarras, teclados, bocinas profesionales, tarima pequeña"
eruda.js:2 🔍 Mapeando header: "requisitos" -> "requisitos" = "Participación abierta, registro en línea, traer instrumento propio si se desea"
eruda.js:2 🔍 Mapeando header: "esRecurrente" -> "esrecurrente" = "No"
eruda.js:2 🔍 Mapeando header: "diasRecurrentes" -> "diasrecurrentes" = ""
eruda.js:2 🔍 Mapeando header: "mercadoObjetivo" -> "mercadoobjetivo" = "Adolescentes"
eruda.js:2 🎯 Mercado objetivo: ["Adolescentes"]
eruda.js:2 🔍 Mapeando header: "necesidadesEspeciales" -> "necesidadesespeciales" = ""
eruda.js:2 🔍 Mapeando header: "permiteRegistroPublico" -> "permiteregistropublico" = ""
eruda.js:2 🔍 Mapeando header: "maxRegistros" -> "maxregistros" = ""
eruda.js:2 🔍 Mapeando header: "fechaLimiteRegistro" -> "fechalimiteregistro" = ""
eruda.js:2 🔍 Mapeando header: "instruccionesRegistro" -> "instruccionesregistro" = ""
eruda.js:2 🔍 Mapeando header: "requiereAprobacion" -> "requiereaprobacion" = ""
eruda.js:2 🔍 Mapeando header: "restriccionesEdad" -> "restriccionesedad" = ""
eruda.js:2 🔍 Mapeando header: "requisitosSalud" -> "requisitossalud" = ""
eruda.js:2 📝 Procesando fila 5: 28 valores: (28) ['Teatro comunitario en el parque', 'Teatro comunitario en el parque con actores amateurs y obras clásicas.', 'Parque Tangamanga I', 'Arte y Cultura', '18/09/25', '18/09/25', '9:00', '11:00', 'Escenario del Lago', '22.144', '-101.019', '45', '75', '100', 'No', 'Telón, focos teatrales, vestuario básico, micrófonos de diadema', 'Registro anticipado, asistencia mínima de diez personas, respeto a turnos de actuación', 'No', '', 'Adultos Mayores', '', '', '', '', '', '', '', '']
eruda.js:2 ✅ Valores ajustados (28): (28) ['Teatro comunitario en el parque', 'Teatro comunitario en el parque con actores amateurs y obras clásicas.', 'Parque Tangamanga I', 'Arte y Cultura', '18/09/25', '18/09/25', '9:00', '11:00', 'Escenario del Lago', '22.144', '-101.019', '45', '75', '100', 'No', 'Telón, focos teatrales, vestuario básico, micrófonos de diadema', 'Registro anticipado, asistencia mínima de diez personas, respeto a turnos de actuación', 'No', '', 'Adultos Mayores', '', '', '', '', '', '', '', '']
eruda.js:2 🔍 Mapeando header: "título" -> "título" = "Teatro comunitario en el parque"
eruda.js:2 🔍 Mapeando header: "descripción" -> "descripción" = "Teatro comunitario en el parque con actores amateurs y obras clásicas."
eruda.js:2 🔍 Mapeando header: "parque" -> "parque" = "Parque Tangamanga I"
eruda.js:2 🏞️ Buscando parque: "Parque Tangamanga I"
eruda.js:2 🏞️ Parques disponibles: (19) ['Bosque Los Colomos', 'Bosque de Chapultepec', 'Gran Parque La Plancha', 'Jardín Botánico de Culiacán', 'Parque Bicentenario', 'Parque Central Ciudad Juárez', 'Parque Cultural Higalguense', 'Parque Ecológico Explora', 'Parque Flor del Bosque', 'Parque Fundidora', 'Parque Guanajuato Bicentenario', 'Parque La Mexicana', 'Parque Las Ribieras', 'Parque Metropolitano de Guadalajara', 'Parque Metropolitano de León', 'Parque Rufino Tamayo', 'Parque Tangamanga I', 'Parque el Capitán', 'Sin especificar']
eruda.js:2 ✅ Parque encontrado: Parque Tangamanga I (ID: 93)
eruda.js:2 🔍 Mapeando header: "categoría" -> "categoría" = "Arte y Cultura"
eruda.js:2 🎨 Buscando categoría: "Arte y Cultura"
eruda.js:2 🎨 Categorías disponibles: (5) ['Arte y Cultura', 'Naturaleza y Ciencia', 'Deportes y Recreación', 'Comunidad', 'Eventos de Temporada']
eruda.js:2 ✅ Categoría encontrada: Arte y Cultura (ID: 1)
eruda.js:2 🔍 Mapeando header: "fechaInicio" -> "fechainicio" = "18/09/25"
eruda.js:2 📅 Fecha inicio convertida: "18/09/25" -> "2025-09-18T00:00:00.000Z"
eruda.js:2 🔍 Mapeando header: "fechaFin" -> "fechafin" = "18/09/25"
eruda.js:2 📅 Fecha fin convertida: "18/09/25" -> "2025-09-18T00:00:00.000Z"
eruda.js:2 🔍 Mapeando header: "horaInicio" -> "horainicio" = "9:00"
eruda.js:2 🔍 Mapeando header: "horaFin" -> "horafin" = "11:00"
eruda.js:2 🔍 Mapeando header: "ubicación" -> "ubicación" = "Escenario del Lago"
eruda.js:2 🔍 Mapeando header: "latitud" -> "latitud" = "22.144"
eruda.js:2 🔍 Mapeando header: "longitud" -> "longitud" = "-101.019"
eruda.js:2 🔍 Mapeando header: "capacidad" -> "capacidad" = "45"
eruda.js:2 🔍 Mapeando header: "duración" -> "duración" = "75"
eruda.js:2 🔍 Mapeando header: "precio" -> "precio" = "100"
eruda.js:2 🔍 Mapeando header: "esGratis" -> "esgratis" = "No"
eruda.js:2 💰 Procesando campo gratis: "No"
eruda.js:2 💰 Es gratis: false
eruda.js:2 🔍 Mapeando header: "materiales" -> "materiales" = "Telón, focos teatrales, vestuario básico, micrófonos de diadema"
eruda.js:2 🔍 Mapeando header: "requisitos" -> "requisitos" = "Registro anticipado, asistencia mínima de diez personas, respeto a turnos de actuación"
eruda.js:2 🔍 Mapeando header: "esRecurrente" -> "esrecurrente" = "No"
eruda.js:2 🔍 Mapeando header: "diasRecurrentes" -> "diasrecurrentes" = ""
eruda.js:2 🔍 Mapeando header: "mercadoObjetivo" -> "mercadoobjetivo" = "Adultos Mayores"
eruda.js:2 🎯 Mercado objetivo: ["Adultos Mayores"]
eruda.js:2 🔍 Mapeando header: "necesidadesEspeciales" -> "necesidadesespeciales" = ""
eruda.js:2 🔍 Mapeando header: "permiteRegistroPublico" -> "permiteregistropublico" = ""
eruda.js:2 🔍 Mapeando header: "maxRegistros" -> "maxregistros" = ""
eruda.js:2 🔍 Mapeando header: "fechaLimiteRegistro" -> "fechalimiteregistro" = ""
eruda.js:2 🔍 Mapeando header: "instruccionesRegistro" -> "instruccionesregistro" = ""
eruda.js:2 🔍 Mapeando header: "requiereAprobacion" -> "requiereaprobacion" = ""
eruda.js:2 🔍 Mapeando header: "restriccionesEdad" -> "restriccionesedad" = ""
eruda.js:2 🔍 Mapeando header: "requisitosSalud" -> "requisitossalud" = ""
eruda.js:2 📝 Procesando fila 6: 28 valores: (28) ['Exhibiciones de fotografía y arte urbano', 'Exhibiciones de fotografía y arte urbano abiertas al público general.', 'Parque Metropolitano de Guadalajara', 'Arte y Cultura', '19/09/25', '19/09/25', '10:00', '12:30', 'Galería al Aire Libre', '20.7167', '-103.45', '40', '105', '120', 'No', 'Paneles móviles, impresoras fotográficas, caballetes de exhibición, luces LED', 'Inscripción gratuita, máximo tres fotografías por participante, material de exhibición propio', 'Si', '', 'Adultos', '', '', '', '', '', '', '', '']
eruda.js:2 ✅ Valores ajustados (28): (28) ['Exhibiciones de fotografía y arte urbano', 'Exhibiciones de fotografía y arte urbano abiertas al público general.', 'Parque Metropolitano de Guadalajara', 'Arte y Cultura', '19/09/25', '19/09/25', '10:00', '12:30', 'Galería al Aire Libre', '20.7167', '-103.45', '40', '105', '120', 'No', 'Paneles móviles, impresoras fotográficas, caballetes de exhibición, luces LED', 'Inscripción gratuita, máximo tres fotografías por participante, material de exhibición propio', 'Si', '', 'Adultos', '', '', '', '', '', '', '', '']
eruda.js:2 🔍 Mapeando header: "título" -> "título" = "Exhibiciones de fotografía y arte urbano"
eruda.js:2 🔍 Mapeando header: "descripción" -> "descripción" = "Exhibiciones de fotografía y arte urbano abiertas al público general."
eruda.js:2 🔍 Mapeando header: "parque" -> "parque" = "Parque Metropolitano de Guadalajara"
eruda.js:2 🏞️ Buscando parque: "Parque Metropolitano de Guadalajara"
eruda.js:2 🏞️ Parques disponibles: (19) ['Bosque Los Colomos', 'Bosque de Chapultepec', 'Gran Parque La Plancha', 'Jardín Botánico de Culiacán', 'Parque Bicentenario', 'Parque Central Ciudad Juárez', 'Parque Cultural Higalguense', 'Parque Ecológico Explora', 'Parque Flor del Bosque', 'Parque Fundidora', 'Parque Guanajuato Bicentenario', 'Parque La Mexicana', 'Parque Las Ribieras', 'Parque Metropolitano de Guadalajara', 'Parque Metropolitano de León', 'Parque Rufino Tamayo', 'Parque Tangamanga I', 'Parque el Capitán', 'Sin especificar']
eruda.js:2 ✅ Parque encontrado: Parque Metropolitano de Guadalajara (ID: 92)
eruda.js:2 🔍 Mapeando header: "categoría" -> "categoría" = "Arte y Cultura"
eruda.js:2 🎨 Buscando categoría: "Arte y Cultura"
eruda.js:2 🎨 Categorías disponibles: (5) ['Arte y Cultura', 'Naturaleza y Ciencia', 'Deportes y Recreación', 'Comunidad', 'Eventos de Temporada']
eruda.js:2 ✅ Categoría encontrada: Arte y Cultura (ID: 1)
eruda.js:2 🔍 Mapeando header: "fechaInicio" -> "fechainicio" = "19/09/25"
eruda.js:2 📅 Fecha inicio convertida: "19/09/25" -> "2025-09-19T00:00:00.000Z"
eruda.js:2 🔍 Mapeando header: "fechaFin" -> "fechafin" = "19/09/25"
eruda.js:2 📅 Fecha fin convertida: "19/09/25" -> "2025-09-19T00:00:00.000Z"
eruda.js:2 🔍 Mapeando header: "horaInicio" -> "horainicio" = "10:00"
eruda.js:2 🔍 Mapeando header: "horaFin" -> "horafin" = "12:30"
eruda.js:2 🔍 Mapeando header: "ubicación" -> "ubicación" = "Galería al Aire Libre"
eruda.js:2 🔍 Mapeando header: "latitud" -> "latitud" = "20.7167"
eruda.js:2 🔍 Mapeando header: "longitud" -> "longitud" = "-103.45"
eruda.js:2 🔍 Mapeando header: "capacidad" -> "capacidad" = "40"
eruda.js:2 🔍 Mapeando header: "duración" -> "duración" = "105"
eruda.js:2 🔍 Mapeando header: "precio" -> "precio" = "120"
eruda.js:2 🔍 Mapeando header: "esGratis" -> "esgratis" = "No"
eruda.js:2 💰 Procesando campo gratis: "No"
eruda.js:2 💰 Es gratis: false
eruda.js:2 🔍 Mapeando header: "materiales" -> "materiales" = "Paneles móviles, impresoras fotográficas, caballetes de exhibición, luces LED"
eruda.js:2 🔍 Mapeando header: "requisitos" -> "requisitos" = "Inscripción gratuita, máximo tres fotografías por participante, material de exhibición propio"
eruda.js:2 🔍 Mapeando header: "esRecurrente" -> "esrecurrente" = "Si"
eruda.js:2 🔍 Mapeando header: "diasRecurrentes" -> "diasrecurrentes" = ""
eruda.js:2 🔍 Mapeando header: "mercadoObjetivo" -> "mercadoobjetivo" = "Adultos"
eruda.js:2 🎯 Mercado objetivo: ["Adultos"]
eruda.js:2 🔍 Mapeando header: "necesidadesEspeciales" -> "necesidadesespeciales" = ""
eruda.js:2 🔍 Mapeando header: "permiteRegistroPublico" -> "permiteregistropublico" = ""
eruda.js:2 🔍 Mapeando header: "maxRegistros" -> "maxregistros" = ""
eruda.js:2 🔍 Mapeando header: "fechaLimiteRegistro" -> "fechalimiteregistro" = ""
eruda.js:2 🔍 Mapeando header: "instruccionesRegistro" -> "instruccionesregistro" = ""
eruda.js:2 🔍 Mapeando header: "requiereAprobacion" -> "requiereaprobacion" = ""
eruda.js:2 🔍 Mapeando header: "restriccionesEdad" -> "restriccionesedad" = ""
eruda.js:2 🔍 Mapeando header: "requisitosSalud" -> "requisitossalud" = ""
eruda.js:2 📝 Procesando fila 7: 28 valores: (28) ['Cuenta cuentos y actividades literarias para niños', 'Cuenta cuentos y actividades literarias para niños en espacios de lectura.', 'Parque Bicentenario', 'Arte y Cultura', '20/09/25', '20/09/25', '11:00', '14:00', 'Rincón de la Lectura', '19.478', '-99.198', '40', '50', '0', 'Si', 'Alfombra de lectura, cojines, libros infantiles, micrófono inalámbrico', 'Actividad dirigida a niños de tres a diez años, acompañados por adulto', 'Si', '', 'Preescolar', '', '', '', '', '', '', '', '']
eruda.js:2 ✅ Valores ajustados (28): (28) ['Cuenta cuentos y actividades literarias para niños', 'Cuenta cuentos y actividades literarias para niños en espacios de lectura.', 'Parque Bicentenario', 'Arte y Cultura', '20/09/25', '20/09/25', '11:00', '14:00', 'Rincón de la Lectura', '19.478', '-99.198', '40', '50', '0', 'Si', 'Alfombra de lectura, cojines, libros infantiles, micrófono inalámbrico', 'Actividad dirigida a niños de tres a diez años, acompañados por adulto', 'Si', '', 'Preescolar', '', '', '', '', '', '', '', '']
eruda.js:2 🔍 Mapeando header: "título" -> "título" = "Cuenta cuentos y actividades literarias para niños"
eruda.js:2 🔍 Mapeando header: "descripción" -> "descripción" = "Cuenta cuentos y actividades literarias para niños en espacios de lectura."
eruda.js:2 🔍 Mapeando header: "parque" -> "parque" = "Parque Bicentenario"
eruda.js:2 🏞️ Buscando parque: "Parque Bicentenario"
eruda.js:2 🏞️ Parques disponibles: (19) ['Bosque Los Colomos', 'Bosque de Chapultepec', 'Gran Parque La Plancha', 'Jardín Botánico de Culiacán', 'Parque Bicentenario', 'Parque Central Ciudad Juárez', 'Parque Cultural Higalguense', 'Parque Ecológico Explora', 'Parque Flor del Bosque', 'Parque Fundidora', 'Parque Guanajuato Bicentenario', 'Parque La Mexicana', 'Parque Las Ribieras', 'Parque Metropolitano de Guadalajara', 'Parque Metropolitano de León', 'Parque Rufino Tamayo', 'Parque Tangamanga I', 'Parque el Capitán', 'Sin especificar']
eruda.js:2 ✅ Parque encontrado: Parque Bicentenario (ID: 91)
eruda.js:2 🔍 Mapeando header: "categoría" -> "categoría" = "Arte y Cultura"
eruda.js:2 🎨 Buscando categoría: "Arte y Cultura"
eruda.js:2 🎨 Categorías disponibles: (5) ['Arte y Cultura', 'Naturaleza y Ciencia', 'Deportes y Recreación', 'Comunidad', 'Eventos de Temporada']
eruda.js:2 ✅ Categoría encontrada: Arte y Cultura (ID: 1)
eruda.js:2 🔍 Mapeando header: "fechaInicio" -> "fechainicio" = "20/09/25"
eruda.js:2 📅 Fecha inicio convertida: "20/09/25" -> "2025-09-20T00:00:00.000Z"
eruda.js:2 🔍 Mapeando header: "fechaFin" -> "fechafin" = "20/09/25"
eruda.js:2 📅 Fecha fin convertida: "20/09/25" -> "2025-09-20T00:00:00.000Z"
eruda.js:2 🔍 Mapeando header: "horaInicio" -> "horainicio" = "11:00"
eruda.js:2 🔍 Mapeando header: "horaFin" -> "horafin" = "14:00"
eruda.js:2 🔍 Mapeando header: "ubicación" -> "ubicación" = "Rincón de la Lectura"
eruda.js:2 🔍 Mapeando header: "latitud" -> "latitud" = "19.478"
eruda.js:2 🔍 Mapeando header: "longitud" -> "longitud" = "-99.198"
eruda.js:2 🔍 Mapeando header: "capacidad" -> "capacidad" = "40"
eruda.js:2 🔍 Mapeando header: "duración" -> "duración" = "50"
eruda.js:2 🔍 Mapeando header: "precio" -> "precio" = "0"
eruda.js:2 🔍 Mapeando header: "esGratis" -> "esgratis" = "Si"
eruda.js:2 💰 Procesando campo gratis: "Si"
eruda.js:2 💰 Es gratis: true
eruda.js:2 🔍 Mapeando header: "materiales" -> "materiales" = "Alfombra de lectura, cojines, libros infantiles, micrófono inalámbrico"
eruda.js:2 🔍 Mapeando header: "requisitos" -> "requisitos" = "Actividad dirigida a niños de tres a diez años, acompañados por adulto"
eruda.js:2 🔍 Mapeando header: "esRecurrente" -> "esrecurrente" = "Si"
eruda.js:2 🔍 Mapeando header: "diasRecurrentes" -> "diasrecurrentes" = ""
eruda.js:2 🔍 Mapeando header: "mercadoObjetivo" -> "mercadoobjetivo" = "Preescolar"
eruda.js:2 🎯 Mercado objetivo: ["Preescolar"]
eruda.js:2 🔍 Mapeando header: "necesidadesEspeciales" -> "necesidadesespeciales" = ""
eruda.js:2 🔍 Mapeando header: "permiteRegistroPublico" -> "permiteregistropublico" = ""
eruda.js:2 🔍 Mapeando header: "maxRegistros" -> "maxregistros" = ""
eruda.js:2 🔍 Mapeando header: "fechaLimiteRegistro" -> "fechalimiteregistro" = ""
eruda.js:2 🔍 Mapeando header: "instruccionesRegistro" -> "instruccionesregistro" = ""
eruda.js:2 🔍 Mapeando header: "requiereAprobacion" -> "requiereaprobacion" = ""
eruda.js:2 🔍 Mapeando header: "restriccionesEdad" -> "restriccionesedad" = ""
eruda.js:2 🔍 Mapeando header: "requisitosSalud" -> "requisitossalud" = ""
eruda.js:2 📝 Procesando fila 8: 28 valores: (28) ['Caminatas guiadas de observación de aves', 'Caminatas guiadas de observación de aves con expertos en biodiversidad local.', 'Parque La Mexicana', 'Naturaleza y Ciencia', '21/09/25', '21/09/25', '12:00', '15:30', 'Sendero Ecológico', '19.36', '-99.28', '150', '140', '180', 'No', 'Binoculares, guías de aves, chalecos identificadores, libreta de campo', 'Reservación previa, cupo máximo veinte personas, traer ropa cómoda y gorra', 'Sí', '', 'Adultos Mayores', '', '', '', '', '', '', '', '']
eruda.js:2 ✅ Valores ajustados (28): (28) ['Caminatas guiadas de observación de aves', 'Caminatas guiadas de observación de aves con expertos en biodiversidad local.', 'Parque La Mexicana', 'Naturaleza y Ciencia', '21/09/25', '21/09/25', '12:00', '15:30', 'Sendero Ecológico', '19.36', '-99.28', '150', '140', '180', 'No', 'Binoculares, guías de aves, chalecos identificadores, libreta de campo', 'Reservación previa, cupo máximo veinte personas, traer ropa cómoda y gorra', 'Sí', '', 'Adultos Mayores', '', '', '', '', '', '', '', '']
eruda.js:2 🔍 Mapeando header: "título" -> "título" = "Caminatas guiadas de observación de aves"
eruda.js:2 🔍 Mapeando header: "descripción" -> "descripción" = "Caminatas guiadas de observación de aves con expertos en biodiversidad local."
eruda.js:2 🔍 Mapeando header: "parque" -> "parque" = "Parque La Mexicana"
eruda.js:2 🏞️ Buscando parque: "Parque La Mexicana"
eruda.js:2 🏞️ Parques disponibles: (19) ['Bosque Los Colomos', 'Bosque de Chapultepec', 'Gran Parque La Plancha', 'Jardín Botánico de Culiacán', 'Parque Bicentenario', 'Parque Central Ciudad Juárez', 'Parque Cultural Higalguense', 'Parque Ecológico Explora', 'Parque Flor del Bosque', 'Parque Fundidora', 'Parque Guanajuato Bicentenario', 'Parque La Mexicana', 'Parque Las Ribieras', 'Parque Metropolitano de Guadalajara', 'Parque Metropolitano de León', 'Parque Rufino Tamayo', 'Parque Tangamanga I', 'Parque el Capitán', 'Sin especificar']
eruda.js:2 ✅ Parque encontrado: Parque La Mexicana (ID: 95)
eruda.js:2 🔍 Mapeando header: "categoría" -> "categoría" = "Naturaleza y Ciencia"
eruda.js:2 🎨 Buscando categoría: "Naturaleza y Ciencia"
eruda.js:2 🎨 Categorías disponibles: (5) ['Arte y Cultura', 'Naturaleza y Ciencia', 'Deportes y Recreación', 'Comunidad', 'Eventos de Temporada']
eruda.js:2 ✅ Categoría encontrada: Naturaleza y Ciencia (ID: 2)
eruda.js:2 🔍 Mapeando header: "fechaInicio" -> "fechainicio" = "21/09/25"
eruda.js:2 📅 Fecha inicio convertida: "21/09/25" -> "2025-09-21T00:00:00.000Z"
eruda.js:2 🔍 Mapeando header: "fechaFin" -> "fechafin" = "21/09/25"
eruda.js:2 📅 Fecha fin convertida: "21/09/25" -> "2025-09-21T00:00:00.000Z"
eruda.js:2 🔍 Mapeando header: "horaInicio" -> "horainicio" = "12:00"
eruda.js:2 🔍 Mapeando header: "horaFin" -> "horafin" = "15:30"
eruda.js:2 🔍 Mapeando header: "ubicación" -> "ubicación" = "Sendero Ecológico"
eruda.js:2 🔍 Mapeando header: "latitud" -> "latitud" = "19.36"
eruda.js:2 🔍 Mapeando header: "longitud" -> "longitud" = "-99.28"
eruda.js:2 🔍 Mapeando header: "capacidad" -> "capacidad" = "150"
eruda.js:2 🔍 Mapeando header: "duración" -> "duración" = "140"
eruda.js:2 🔍 Mapeando header: "precio" -> "precio" = "180"
eruda.js:2 🔍 Mapeando header: "esGratis" -> "esgratis" = "No"
eruda.js:2 💰 Procesando campo gratis: "No"
eruda.js:2 💰 Es gratis: false
eruda.js:2 🔍 Mapeando header: "materiales" -> "materiales" = "Binoculares, guías de aves, chalecos identificadores, libreta de campo"
eruda.js:2 🔍 Mapeando header: "requisitos" -> "requisitos" = "Reservación previa, cupo máximo veinte personas, traer ropa cómoda y gorra"
eruda.js:2 🔍 Mapeando header: "esRecurrente" -> "esrecurrente" = "Sí"
eruda.js:2 🔍 Mapeando header: "diasRecurrentes" -> "diasrecurrentes" = ""
eruda.js:2 🔍 Mapeando header: "mercadoObjetivo" -> "mercadoobjetivo" = "Adultos Mayores"
eruda.js:2 🎯 Mercado objetivo: ["Adultos Mayores"]
eruda.js:2 🔍 Mapeando header: "necesidadesEspeciales" -> "necesidadesespeciales" = ""
eruda.js:2 🔍 Mapeando header: "permiteRegistroPublico" -> "permiteregistropublico" = ""
eruda.js:2 🔍 Mapeando header: "maxRegistros" -> "maxregistros" = ""
eruda.js:2 🔍 Mapeando header: "fechaLimiteRegistro" -> "fechalimiteregistro" = ""
eruda.js:2 🔍 Mapeando header: "instruccionesRegistro" -> "instruccionesregistro" = ""
eruda.js:2 🔍 Mapeando header: "requiereAprobacion" -> "requiereaprobacion" = ""
eruda.js:2 🔍 Mapeando header: "restriccionesEdad" -> "restriccionesedad" = ""
eruda.js:2 🔍 Mapeando header: "requisitosSalud" -> "requisitossalud" = ""
eruda.js:2 📝 Procesando fila 9: 28 valores: (28) ['Talleres de jardinería y compostaje', 'Talleres de jardinería y compostaje para aprender técnicas de cultivo sustentable.', 'Parque Rufino Tamayo', 'Naturaleza y Ciencia', '22/09/25', '22/09/25', '13:00', '17:00', 'Huerto Educativo', '25.65', '-100.36', '200', '80', '0', 'Si', 'Macetas, tierra, semillas, composta, guantes de jardinería', 'Actividad familiar, cupo limitado a quince personas, traer guantes de jardinería', 'Si', '', 'Adultos', '', '', '', '', '', '', '', '']
eruda.js:2 ✅ Valores ajustados (28): (28) ['Talleres de jardinería y compostaje', 'Talleres de jardinería y compostaje para aprender técnicas de cultivo sustentable.', 'Parque Rufino Tamayo', 'Naturaleza y Ciencia', '22/09/25', '22/09/25', '13:00', '17:00', 'Huerto Educativo', '25.65', '-100.36', '200', '80', '0', 'Si', 'Macetas, tierra, semillas, composta, guantes de jardinería', 'Actividad familiar, cupo limitado a quince personas, traer guantes de jardinería', 'Si', '', 'Adultos', '', '', '', '', '', '', '', '']
eruda.js:2 🔍 Mapeando header: "título" -> "título" = "Talleres de jardinería y compostaje"
eruda.js:2 🔍 Mapeando header: "descripción" -> "descripción" = "Talleres de jardinería y compostaje para aprender técnicas de cultivo sustentable."
eruda.js:2 🔍 Mapeando header: "parque" -> "parque" = "Parque Rufino Tamayo"
eruda.js:2 🏞️ Buscando parque: "Parque Rufino Tamayo"
eruda.js:2 🏞️ Parques disponibles: (19) ['Bosque Los Colomos', 'Bosque de Chapultepec', 'Gran Parque La Plancha', 'Jardín Botánico de Culiacán', 'Parque Bicentenario', 'Parque Central Ciudad Juárez', 'Parque Cultural Higalguense', 'Parque Ecológico Explora', 'Parque Flor del Bosque', 'Parque Fundidora', 'Parque Guanajuato Bicentenario', 'Parque La Mexicana', 'Parque Las Ribieras', 'Parque Metropolitano de Guadalajara', 'Parque Metropolitano de León', 'Parque Rufino Tamayo', 'Parque Tangamanga I', 'Parque el Capitán', 'Sin especificar']
eruda.js:2 ✅ Parque encontrado: Parque Rufino Tamayo (ID: 97)
eruda.js:2 🔍 Mapeando header: "categoría" -> "categoría" = "Naturaleza y Ciencia"
eruda.js:2 🎨 Buscando categoría: "Naturaleza y Ciencia"
eruda.js:2 🎨 Categorías disponibles: (5) ['Arte y Cultura', 'Naturaleza y Ciencia', 'Deportes y Recreación', 'Comunidad', 'Eventos de Temporada']
eruda.js:2 ✅ Categoría encontrada: Naturaleza y Ciencia (ID: 2)
eruda.js:2 🔍 Mapeando header: "fechaInicio" -> "fechainicio" = "22/09/25"
eruda.js:2 📅 Fecha inicio convertida: "22/09/25" -> "2025-09-22T00:00:00.000Z"
eruda.js:2 🔍 Mapeando header: "fechaFin" -> "fechafin" = "22/09/25"
eruda.js:2 📅 Fecha fin convertida: "22/09/25" -> "2025-09-22T00:00:00.000Z"
eruda.js:2 🔍 Mapeando header: "horaInicio" -> "horainicio" = "13:00"
eruda.js:2 🔍 Mapeando header: "horaFin" -> "horafin" = "17:00"
eruda.js:2 🔍 Mapeando header: "ubicación" -> "ubicación" = "Huerto Educativo"
eruda.js:2 🔍 Mapeando header: "latitud" -> "latitud" = "25.65"
eruda.js:2 🔍 Mapeando header: "longitud" -> "longitud" = "-100.36"
eruda.js:2 🔍 Mapeando header: "capacidad" -> "capacidad" = "200"
eruda.js:2 🔍 Mapeando header: "duración" -> "duración" = "80"
eruda.js:2 🔍 Mapeando header: "precio" -> "precio" = "0"
eruda.js:2 🔍 Mapeando header: "esGratis" -> "esgratis" = "Si"
eruda.js:2 💰 Procesando campo gratis: "Si"
eruda.js:2 💰 Es gratis: true
eruda.js:2 🔍 Mapeando header: "materiales" -> "materiales" = "Macetas, tierra, semillas, composta, guantes de jardinería"
eruda.js:2 🔍 Mapeando header: "requisitos" -> "requisitos" = "Actividad familiar, cupo limitado a quince personas, traer guantes de jardinería"
eruda.js:2 🔍 Mapeando header: "esRecurrente" -> "esrecurrente" = "Si"
eruda.js:2 🔍 Mapeando header: "diasRecurrentes" -> "diasrecurrentes" = ""
eruda.js:2 🔍 Mapeando header: "mercadoObjetivo" -> "mercadoobjetivo" = "Adultos"
eruda.js:2 🎯 Mercado objetivo: ["Adultos"]
eruda.js:2 🔍 Mapeando header: "necesidadesEspeciales" -> "necesidadesespeciales" = ""
eruda.js:2 🔍 Mapeando header: "permiteRegistroPublico" -> "permiteregistropublico" = ""
eruda.js:2 🔍 Mapeando header: "maxRegistros" -> "maxregistros" = ""
eruda.js:2 🔍 Mapeando header: "fechaLimiteRegistro" -> "fechalimiteregistro" = ""
eruda.js:2 🔍 Mapeando header: "instruccionesRegistro" -> "instruccionesregistro" = ""
eruda.js:2 🔍 Mapeando header: "requiereAprobacion" -> "requiereaprobacion" = ""
eruda.js:2 🔍 Mapeando header: "restriccionesEdad" -> "restriccionesedad" = ""
eruda.js:2 🔍 Mapeando header: "requisitosSalud" -> "requisitossalud" = ""
eruda.js:2 📝 Procesando fila 10: 28 valores: (28) ['Sesiones de meditación y mindfulness', 'Sesiones de meditación y mindfulness en espacios tranquilos rodeados de naturaleza.', 'Parque Central Ciudad Juárez', 'Naturaleza y Ciencia', '23/09/25', '23/09/25', '14:00', '18:30', 'Jardín Zen', '20.99', '-89.63', '26', '55', '50', 'No', 'Tapetes, incienso, difusores de aroma, cojines de meditación', 'Edad mínima doce años, ropa cómoda, silencio absoluto durante la práctica', 'No', '', 'Adultos', '', '', '', '', '', '', '', '']
eruda.js:2 ✅ Valores ajustados (28): (28) ['Sesiones de meditación y mindfulness', 'Sesiones de meditación y mindfulness en espacios tranquilos rodeados de naturaleza.', 'Parque Central Ciudad Juárez', 'Naturaleza y Ciencia', '23/09/25', '23/09/25', '14:00', '18:30', 'Jardín Zen', '20.99', '-89.63', '26', '55', '50', 'No', 'Tapetes, incienso, difusores de aroma, cojines de meditación', 'Edad mínima doce años, ropa cómoda, silencio absoluto durante la práctica', 'No', '', 'Adultos', '', '', '', '', '', '', '', '']
eruda.js:2 🔍 Mapeando header: "título" -> "título" = "Sesiones de meditación y mindfulness"
eruda.js:2 🔍 Mapeando header: "descripción" -> "descripción" = "Sesiones de meditación y mindfulness en espacios tranquilos rodeados de naturaleza."
eruda.js:2 🔍 Mapeando header: "parque" -> "parque" = "Parque Central Ciudad Juárez"
eruda.js:2 🏞️ Buscando parque: "Parque Central Ciudad Juárez"
eruda.js:2 🏞️ Parques disponibles: (19) ['Bosque Los Colomos', 'Bosque de Chapultepec', 'Gran Parque La Plancha', 'Jardín Botánico de Culiacán', 'Parque Bicentenario', 'Parque Central Ciudad Juárez', 'Parque Cultural Higalguense', 'Parque Ecológico Explora', 'Parque Flor del Bosque', 'Parque Fundidora', 'Parque Guanajuato Bicentenario', 'Parque La Mexicana', 'Parque Las Ribieras', 'Parque Metropolitano de Guadalajara', 'Parque Metropolitano de León', 'Parque Rufino Tamayo', 'Parque Tangamanga I', 'Parque el Capitán', 'Sin especificar']
eruda.js:2 ✅ Parque encontrado: Parque Central Ciudad Juárez (ID: 98)
eruda.js:2 🔍 Mapeando header: "categoría" -> "categoría" = "Naturaleza y Ciencia"
eruda.js:2 🎨 Buscando categoría: "Naturaleza y Ciencia"
eruda.js:2 🎨 Categorías disponibles: (5) ['Arte y Cultura', 'Naturaleza y Ciencia', 'Deportes y Recreación', 'Comunidad', 'Eventos de Temporada']
eruda.js:2 ✅ Categoría encontrada: Naturaleza y Ciencia (ID: 2)
eruda.js:2 🔍 Mapeando header: "fechaInicio" -> "fechainicio" = "23/09/25"
eruda.js:2 📅 Fecha inicio convertida: "23/09/25" -> "2025-09-23T00:00:00.000Z"
eruda.js:2 🔍 Mapeando header: "fechaFin" -> "fechafin" = "23/09/25"
eruda.js:2 📅 Fecha fin convertida: "23/09/25" -> "2025-09-23T00:00:00.000Z"
eruda.js:2 🔍 Mapeando header: "horaInicio" -> "horainicio" = "14:00"
eruda.js:2 🔍 Mapeando header: "horaFin" -> "horafin" = "18:30"
eruda.js:2 🔍 Mapeando header: "ubicación" -> "ubicación" = "Jardín Zen"
eruda.js:2 🔍 Mapeando header: "latitud" -> "latitud" = "20.99"
eruda.js:2 🔍 Mapeando header: "longitud" -> "longitud" = "-89.63"
eruda.js:2 🔍 Mapeando header: "capacidad" -> "capacidad" = "26"
eruda.js:2 🔍 Mapeando header: "duración" -> "duración" = "55"
eruda.js:2 🔍 Mapeando header: "precio" -> "precio" = "50"
eruda.js:2 🔍 Mapeando header: "esGratis" -> "esgratis" = "No"
eruda.js:2 💰 Procesando campo gratis: "No"
eruda.js:2 💰 Es gratis: false
eruda.js:2 🔍 Mapeando header: "materiales" -> "materiales" = "Tapetes, incienso, difusores de aroma, cojines de meditación"
eruda.js:2 🔍 Mapeando header: "requisitos" -> "requisitos" = "Edad mínima doce años, ropa cómoda, silencio absoluto durante la práctica"
eruda.js:2 🔍 Mapeando header: "esRecurrente" -> "esrecurrente" = "No"
eruda.js:2 🔍 Mapeando header: "diasRecurrentes" -> "diasrecurrentes" = ""
eruda.js:2 🔍 Mapeando header: "mercadoObjetivo" -> "mercadoobjetivo" = "Adultos"
eruda.js:2 🎯 Mercado objetivo: ["Adultos"]
eruda.js:2 🔍 Mapeando header: "necesidadesEspeciales" -> "necesidadesespeciales" = ""
eruda.js:2 🔍 Mapeando header: "permiteRegistroPublico" -> "permiteregistropublico" = ""
eruda.js:2 🔍 Mapeando header: "maxRegistros" -> "maxregistros" = ""
eruda.js:2 🔍 Mapeando header: "fechaLimiteRegistro" -> "fechalimiteregistro" = ""
eruda.js:2 🔍 Mapeando header: "instruccionesRegistro" -> "instruccionesregistro" = ""
eruda.js:2 🔍 Mapeando header: "requiereAprobacion" -> "requiereaprobacion" = ""
eruda.js:2 🔍 Mapeando header: "restriccionesEdad" -> "restriccionesedad" = ""
eruda.js:2 🔍 Mapeando header: "requisitosSalud" -> "requisitossalud" = ""
eruda.js:2 📝 Procesando fila 11: 28 valores: (28) ['Senderismo en rutas señalizadas', 'Picnic comunitario con juegos tradicionales que fomentan convivencia y amistad.', 'Parque Guanajuato Bicentenario', 'Naturaleza y Ciencia', '24/09/25', '24/09/25', '8:00', '9:30', 'Prado Familiar', '21.02', '-89.65', '45', '120', '0', 'Si', 'Manteles, canastas, juegos tradicionales, pelotas inflables', 'Acceso libre, traer alimentos sin envases de vidrio, respeto a áreas verdes', 'No', '', 'Niños', '', '', '', '', '', '', '', '']
eruda.js:2 ✅ Valores ajustados (28): (28) ['Senderismo en rutas señalizadas', 'Picnic comunitario con juegos tradicionales que fomentan convivencia y amistad.', 'Parque Guanajuato Bicentenario', 'Naturaleza y Ciencia', '24/09/25', '24/09/25', '8:00', '9:30', 'Prado Familiar', '21.02', '-89.65', '45', '120', '0', 'Si', 'Manteles, canastas, juegos tradicionales, pelotas inflables', 'Acceso libre, traer alimentos sin envases de vidrio, respeto a áreas verdes', 'No', '', 'Niños', '', '', '', '', '', '', '', '']
eruda.js:2 🔍 Mapeando header: "título" -> "título" = "Senderismo en rutas señalizadas"
eruda.js:2 🔍 Mapeando header: "descripción" -> "descripción" = "Picnic comunitario con juegos tradicionales que fomentan convivencia y amistad."
eruda.js:2 🔍 Mapeando header: "parque" -> "parque" = "Parque Guanajuato Bicentenario"
eruda.js:2 🏞️ Buscando parque: "Parque Guanajuato Bicentenario"
eruda.js:2 🏞️ Parques disponibles: (19) ['Bosque Los Colomos', 'Bosque de Chapultepec', 'Gran Parque La Plancha', 'Jardín Botánico de Culiacán', 'Parque Bicentenario', 'Parque Central Ciudad Juárez', 'Parque Cultural Higalguense', 'Parque Ecológico Explora', 'Parque Flor del Bosque', 'Parque Fundidora', 'Parque Guanajuato Bicentenario', 'Parque La Mexicana', 'Parque Las Ribieras', 'Parque Metropolitano de Guadalajara', 'Parque Metropolitano de León', 'Parque Rufino Tamayo', 'Parque Tangamanga I', 'Parque el Capitán', 'Sin especificar']
eruda.js:2 ✅ Parque encontrado: Parque Guanajuato Bicentenario (ID: 96)
eruda.js:2 🔍 Mapeando header: "categoría" -> "categoría" = "Naturaleza y Ciencia"
eruda.js:2 🎨 Buscando categoría: "Naturaleza y Ciencia"
eruda.js:2 🎨 Categorías disponibles: (5) ['Arte y Cultura', 'Naturaleza y Ciencia', 'Deportes y Recreación', 'Comunidad', 'Eventos de Temporada']
eruda.js:2 ✅ Categoría encontrada: Naturaleza y Ciencia (ID: 2)
eruda.js:2 🔍 Mapeando header: "fechaInicio" -> "fechainicio" = "24/09/25"
eruda.js:2 📅 Fecha inicio convertida: "24/09/25" -> "2025-09-24T00:00:00.000Z"
eruda.js:2 🔍 Mapeando header: "fechaFin" -> "fechafin" = "24/09/25"
eruda.js:2 📅 Fecha fin convertida: "24/09/25" -> "2025-09-24T00:00:00.000Z"
eruda.js:2 🔍 Mapeando header: "horaInicio" -> "horainicio" = "8:00"
eruda.js:2 🔍 Mapeando header: "horaFin" -> "horafin" = "9:30"
eruda.js:2 🔍 Mapeando header: "ubicación" -> "ubicación" = "Prado Familiar"
eruda.js:2 🔍 Mapeando header: "latitud" -> "latitud" = "21.02"
eruda.js:2 🔍 Mapeando header: "longitud" -> "longitud" = "-89.65"
eruda.js:2 🔍 Mapeando header: "capacidad" -> "capacidad" = "45"
eruda.js:2 🔍 Mapeando header: "duración" -> "duración" = "120"
eruda.js:2 🔍 Mapeando header: "precio" -> "precio" = "0"
eruda.js:2 🔍 Mapeando header: "esGratis" -> "esgratis" = "Si"
eruda.js:2 💰 Procesando campo gratis: "Si"
eruda.js:2 💰 Es gratis: true
eruda.js:2 🔍 Mapeando header: "materiales" -> "materiales" = "Manteles, canastas, juegos tradicionales, pelotas inflables"
eruda.js:2 🔍 Mapeando header: "requisitos" -> "requisitos" = "Acceso libre, traer alimentos sin envases de vidrio, respeto a áreas verdes"
eruda.js:2 🔍 Mapeando header: "esRecurrente" -> "esrecurrente" = "No"
eruda.js:2 🔍 Mapeando header: "diasRecurrentes" -> "diasrecurrentes" = ""
eruda.js:2 🔍 Mapeando header: "mercadoObjetivo" -> "mercadoobjetivo" = "Niños"
eruda.js:2 🎯 Mercado objetivo: ["Niños"]
eruda.js:2 🔍 Mapeando header: "necesidadesEspeciales" -> "necesidadesespeciales" = ""
eruda.js:2 🔍 Mapeando header: "permiteRegistroPublico" -> "permiteregistropublico" = ""
eruda.js:2 🔍 Mapeando header: "maxRegistros" -> "maxregistros" = ""
eruda.js:2 🔍 Mapeando header: "fechaLimiteRegistro" -> "fechalimiteregistro" = ""
eruda.js:2 🔍 Mapeando header: "instruccionesRegistro" -> "instruccionesregistro" = ""
eruda.js:2 🔍 Mapeando header: "requiereAprobacion" -> "requiereaprobacion" = ""
eruda.js:2 🔍 Mapeando header: "restriccionesEdad" -> "restriccionesedad" = ""
eruda.js:2 🔍 Mapeando header: "requisitosSalud" -> "requisitossalud" = ""
eruda.js:2 📝 Procesando fila 12: 28 valores: (28) ['Picnic comunitario con juegos tradicionales', 'Senderismo en rutas señalizadas que promueven la actividad física y el contacto natural.', 'Parque el Capitán', 'Naturaleza y Ciencia', '25/09/25', '25/09/25', '8:00', '9:30', 'Ruta del Bosque', '25.66521872', '-100.360811', '30', '90', '90', 'No', 'Señalización, mapas, bastones de senderismo, bebederos portátiles', 'Actividad abierta, llevar calzado cómodo, no salirse de rutas marcadas', 'Si', '', 'Adolescentes', '', '', '', '', '', '', '', '']
eruda.js:2 ✅ Valores ajustados (28): (28) ['Picnic comunitario con juegos tradicionales', 'Senderismo en rutas señalizadas que promueven la actividad física y el contacto natural.', 'Parque el Capitán', 'Naturaleza y Ciencia', '25/09/25', '25/09/25', '8:00', '9:30', 'Ruta del Bosque', '25.66521872', '-100.360811', '30', '90', '90', 'No', 'Señalización, mapas, bastones de senderismo, bebederos portátiles', 'Actividad abierta, llevar calzado cómodo, no salirse de rutas marcadas', 'Si', '', 'Adolescentes', '', '', '', '', '', '', '', '']
eruda.js:2 🔍 Mapeando header: "título" -> "título" = "Picnic comunitario con juegos tradicionales"
eruda.js:2 🔍 Mapeando header: "descripción" -> "descripción" = "Senderismo en rutas señalizadas que promueven la actividad física y el contacto natural."
eruda.js:2 🔍 Mapeando header: "parque" -> "parque" = "Parque el Capitán"
eruda.js:2 🏞️ Buscando parque: "Parque el Capitán"
eruda.js:2 🏞️ Parques disponibles: (19) ['Bosque Los Colomos', 'Bosque de Chapultepec', 'Gran Parque La Plancha', 'Jardín Botánico de Culiacán', 'Parque Bicentenario', 'Parque Central Ciudad Juárez', 'Parque Cultural Higalguense', 'Parque Ecológico Explora', 'Parque Flor del Bosque', 'Parque Fundidora', 'Parque Guanajuato Bicentenario', 'Parque La Mexicana', 'Parque Las Ribieras', 'Parque Metropolitano de Guadalajara', 'Parque Metropolitano de León', 'Parque Rufino Tamayo', 'Parque Tangamanga I', 'Parque el Capitán', 'Sin especificar']
eruda.js:2 ✅ Parque encontrado: Parque el Capitán (ID: 87)
eruda.js:2 🔍 Mapeando header: "categoría" -> "categoría" = "Naturaleza y Ciencia"
eruda.js:2 🎨 Buscando categoría: "Naturaleza y Ciencia"
eruda.js:2 🎨 Categorías disponibles: (5) ['Arte y Cultura', 'Naturaleza y Ciencia', 'Deportes y Recreación', 'Comunidad', 'Eventos de Temporada']
eruda.js:2 ✅ Categoría encontrada: Naturaleza y Ciencia (ID: 2)
eruda.js:2 🔍 Mapeando header: "fechaInicio" -> "fechainicio" = "25/09/25"
eruda.js:2 📅 Fecha inicio convertida: "25/09/25" -> "2025-09-25T00:00:00.000Z"
eruda.js:2 🔍 Mapeando header: "fechaFin" -> "fechafin" = "25/09/25"
eruda.js:2 📅 Fecha fin convertida: "25/09/25" -> "2025-09-25T00:00:00.000Z"
eruda.js:2 🔍 Mapeando header: "horaInicio" -> "horainicio" = "8:00"
eruda.js:2 🔍 Mapeando header: "horaFin" -> "horafin" = "9:30"
eruda.js:2 🔍 Mapeando header: "ubicación" -> "ubicación" = "Ruta del Bosque"
eruda.js:2 🔍 Mapeando header: "latitud" -> "latitud" = "25.66521872"
eruda.js:2 🔍 Mapeando header: "longitud" -> "longitud" = "-100.360811"
eruda.js:2 🔍 Mapeando header: "capacidad" -> "capacidad" = "30"
eruda.js:2 🔍 Mapeando header: "duración" -> "duración" = "90"
eruda.js:2 🔍 Mapeando header: "precio" -> "precio" = "90"
eruda.js:2 🔍 Mapeando header: "esGratis" -> "esgratis" = "No"
eruda.js:2 💰 Procesando campo gratis: "No"
eruda.js:2 💰 Es gratis: false
eruda.js:2 🔍 Mapeando header: "materiales" -> "materiales" = "Señalización, mapas, bastones de senderismo, bebederos portátiles"
eruda.js:2 🔍 Mapeando header: "requisitos" -> "requisitos" = "Actividad abierta, llevar calzado cómodo, no salirse de rutas marcadas"
eruda.js:2 🔍 Mapeando header: "esRecurrente" -> "esrecurrente" = "Si"
eruda.js:2 🔍 Mapeando header: "diasRecurrentes" -> "diasrecurrentes" = ""
eruda.js:2 🔍 Mapeando header: "mercadoObjetivo" -> "mercadoobjetivo" = "Adolescentes"
eruda.js:2 🎯 Mercado objetivo: ["Adolescentes"]
eruda.js:2 🔍 Mapeando header: "necesidadesEspeciales" -> "necesidadesespeciales" = ""
eruda.js:2 🔍 Mapeando header: "permiteRegistroPublico" -> "permiteregistropublico" = ""
eruda.js:2 🔍 Mapeando header: "maxRegistros" -> "maxregistros" = ""
eruda.js:2 🔍 Mapeando header: "fechaLimiteRegistro" -> "fechalimiteregistro" = ""
eruda.js:2 🔍 Mapeando header: "instruccionesRegistro" -> "instruccionesregistro" = ""
eruda.js:2 🔍 Mapeando header: "requiereAprobacion" -> "requiereaprobacion" = ""
eruda.js:2 🔍 Mapeando header: "restriccionesEdad" -> "restriccionesedad" = ""
eruda.js:2 🔍 Mapeando header: "requisitosSalud" -> "requisitossalud" = ""
eruda.js:2 📝 Procesando fila 13: 28 valores: (28) ['Circuito de ejercicio al aire libre (outdoor gym)', 'Circuito de ejercicio al aire libre con máquinas y estaciones de entrenamiento.', 'Parque Metropolitano de León', 'Naturaleza y Ciencia', '26/09/25', '26/09/25', '8:00', '9:30', 'Zona Fitness', '31.72', '-106.43', '100', '45', '0', 'Si', 'Barras paralelas, bicicletas estáticas, escaladoras, señalética de rutinas', 'Uso obligatorio de toalla y agua personal, cupo máximo veinte usuarios por sesión', 'Si', '', 'Adultos', '', '', '', '', '', '', '', '']
eruda.js:2 ✅ Valores ajustados (28): (28) ['Circuito de ejercicio al aire libre (outdoor gym)', 'Circuito de ejercicio al aire libre con máquinas y estaciones de entrenamiento.', 'Parque Metropolitano de León', 'Naturaleza y Ciencia', '26/09/25', '26/09/25', '8:00', '9:30', 'Zona Fitness', '31.72', '-106.43', '100', '45', '0', 'Si', 'Barras paralelas, bicicletas estáticas, escaladoras, señalética de rutinas', 'Uso obligatorio de toalla y agua personal, cupo máximo veinte usuarios por sesión', 'Si', '', 'Adultos', '', '', '', '', '', '', '', '']
eruda.js:2 🔍 Mapeando header: "título" -> "título" = "Circuito de ejercicio al aire libre (outdoor gym)"
eruda.js:2 🔍 Mapeando header: "descripción" -> "descripción" = "Circuito de ejercicio al aire libre con máquinas y estaciones de entrenamiento."
eruda.js:2 🔍 Mapeando header: "parque" -> "parque" = "Parque Metropolitano de León"
eruda.js:2 🏞️ Buscando parque: "Parque Metropolitano de León"
eruda.js:2 🏞️ Parques disponibles: (19) ['Bosque Los Colomos', 'Bosque de Chapultepec', 'Gran Parque La Plancha', 'Jardín Botánico de Culiacán', 'Parque Bicentenario', 'Parque Central Ciudad Juárez', 'Parque Cultural Higalguense', 'Parque Ecológico Explora', 'Parque Flor del Bosque', 'Parque Fundidora', 'Parque Guanajuato Bicentenario', 'Parque La Mexicana', 'Parque Las Ribieras', 'Parque Metropolitano de Guadalajara', 'Parque Metropolitano de León', 'Parque Rufino Tamayo', 'Parque Tangamanga I', 'Parque el Capitán', 'Sin especificar']
eruda.js:2 ✅ Parque encontrado: Parque Metropolitano de León (ID: 88)
eruda.js:2 🔍 Mapeando header: "categoría" -> "categoría" = "Naturaleza y Ciencia"
eruda.js:2 🎨 Buscando categoría: "Naturaleza y Ciencia"
eruda.js:2 🎨 Categorías disponibles: (5) ['Arte y Cultura', 'Naturaleza y Ciencia', 'Deportes y Recreación', 'Comunidad', 'Eventos de Temporada']
eruda.js:2 ✅ Categoría encontrada: Naturaleza y Ciencia (ID: 2)
eruda.js:2 🔍 Mapeando header: "fechaInicio" -> "fechainicio" = "26/09/25"
eruda.js:2 📅 Fecha inicio convertida: "26/09/25" -> "2025-09-26T00:00:00.000Z"
eruda.js:2 🔍 Mapeando header: "fechaFin" -> "fechafin" = "26/09/25"
eruda.js:2 📅 Fecha fin convertida: "26/09/25" -> "2025-09-26T00:00:00.000Z"
eruda.js:2 🔍 Mapeando header: "horaInicio" -> "horainicio" = "8:00"
eruda.js:2 🔍 Mapeando header: "horaFin" -> "horafin" = "9:30"
eruda.js:2 🔍 Mapeando header: "ubicación" -> "ubicación" = "Zona Fitness"
eruda.js:2 🔍 Mapeando header: "latitud" -> "latitud" = "31.72"
eruda.js:2 🔍 Mapeando header: "longitud" -> "longitud" = "-106.43"
eruda.js:2 🔍 Mapeando header: "capacidad" -> "capacidad" = "100"
eruda.js:2 🔍 Mapeando header: "duración" -> "duración" = "45"
eruda.js:2 🔍 Mapeando header: "precio" -> "precio" = "0"
eruda.js:2 🔍 Mapeando header: "esGratis" -> "esgratis" = "Si"
eruda.js:2 💰 Procesando campo gratis: "Si"
eruda.js:2 💰 Es gratis: true
eruda.js:2 🔍 Mapeando header: "materiales" -> "materiales" = "Barras paralelas, bicicletas estáticas, escaladoras, señalética de rutinas"
eruda.js:2 🔍 Mapeando header: "requisitos" -> "requisitos" = "Uso obligatorio de toalla y agua personal, cupo máximo veinte usuarios por sesión"
eruda.js:2 🔍 Mapeando header: "esRecurrente" -> "esrecurrente" = "Si"
eruda.js:2 🔍 Mapeando header: "diasRecurrentes" -> "diasrecurrentes" = ""
eruda.js:2 🔍 Mapeando header: "mercadoObjetivo" -> "mercadoobjetivo" = "Adultos"
eruda.js:2 🎯 Mercado objetivo: ["Adultos"]
eruda.js:2 🔍 Mapeando header: "necesidadesEspeciales" -> "necesidadesespeciales" = ""
eruda.js:2 🔍 Mapeando header: "permiteRegistroPublico" -> "permiteregistropublico" = ""
eruda.js:2 🔍 Mapeando header: "maxRegistros" -> "maxregistros" = ""
eruda.js:2 🔍 Mapeando header: "fechaLimiteRegistro" -> "fechalimiteregistro" = ""
eruda.js:2 🔍 Mapeando header: "instruccionesRegistro" -> "instruccionesregistro" = ""
eruda.js:2 🔍 Mapeando header: "requiereAprobacion" -> "requiereaprobacion" = ""
eruda.js:2 🔍 Mapeando header: "restriccionesEdad" -> "restriccionesedad" = ""
eruda.js:2 🔍 Mapeando header: "requisitosSalud" -> "requisitossalud" = ""
eruda.js:2 📝 Procesando fila 14: 28 valores: (28) ['Clases de yoga al aire libre', 'Clases de yoga al aire libre para relajarse, estirar y fortalecer el cuerpo.', 'Gran Parque La Plancha', 'Deportes y Recreación', '27/09/25', '27/09/25', '9:00', '11:00', 'Terraza del Sol', '20.97844437', '-89.61172739', '20', '60', '70', 'No', 'Tapetes de yoga, bocinas portátiles, velas decorativas, instructivo visual', 'Reservar con anticipación, llevar tapete personal, ropa cómoda y ligera', 'Sí', '', 'Adultos Mayores', '', '', '', '', '', '', '', '']
eruda.js:2 ✅ Valores ajustados (28): (28) ['Clases de yoga al aire libre', 'Clases de yoga al aire libre para relajarse, estirar y fortalecer el cuerpo.', 'Gran Parque La Plancha', 'Deportes y Recreación', '27/09/25', '27/09/25', '9:00', '11:00', 'Terraza del Sol', '20.97844437', '-89.61172739', '20', '60', '70', 'No', 'Tapetes de yoga, bocinas portátiles, velas decorativas, instructivo visual', 'Reservar con anticipación, llevar tapete personal, ropa cómoda y ligera', 'Sí', '', 'Adultos Mayores', '', '', '', '', '', '', '', '']
eruda.js:2 🔍 Mapeando header: "título" -> "título" = "Clases de yoga al aire libre"
eruda.js:2 🔍 Mapeando header: "descripción" -> "descripción" = "Clases de yoga al aire libre para relajarse, estirar y fortalecer el cuerpo."
eruda.js:2 🔍 Mapeando header: "parque" -> "parque" = "Gran Parque La Plancha"
eruda.js:2 🏞️ Buscando parque: "Gran Parque La Plancha"
eruda.js:2 🏞️ Parques disponibles: (19) ['Bosque Los Colomos', 'Bosque de Chapultepec', 'Gran Parque La Plancha', 'Jardín Botánico de Culiacán', 'Parque Bicentenario', 'Parque Central Ciudad Juárez', 'Parque Cultural Higalguense', 'Parque Ecológico Explora', 'Parque Flor del Bosque', 'Parque Fundidora', 'Parque Guanajuato Bicentenario', 'Parque La Mexicana', 'Parque Las Ribieras', 'Parque Metropolitano de Guadalajara', 'Parque Metropolitano de León', 'Parque Rufino Tamayo', 'Parque Tangamanga I', 'Parque el Capitán', 'Sin especificar']
eruda.js:2 ✅ Parque encontrado: Gran Parque La Plancha (ID: 89)
eruda.js:2 🔍 Mapeando header: "categoría" -> "categoría" = "Deportes y Recreación"
eruda.js:2 🎨 Buscando categoría: "Deportes y Recreación"
eruda.js:2 🎨 Categorías disponibles: (5) ['Arte y Cultura', 'Naturaleza y Ciencia', 'Deportes y Recreación', 'Comunidad', 'Eventos de Temporada']
eruda.js:2 ✅ Categoría encontrada: Deportes y Recreación (ID: 3)
eruda.js:2 🔍 Mapeando header: "fechaInicio" -> "fechainicio" = "27/09/25"
eruda.js:2 📅 Fecha inicio convertida: "27/09/25" -> "2025-09-27T00:00:00.000Z"
eruda.js:2 🔍 Mapeando header: "fechaFin" -> "fechafin" = "27/09/25"
eruda.js:2 📅 Fecha fin convertida: "27/09/25" -> "2025-09-27T00:00:00.000Z"
eruda.js:2 🔍 Mapeando header: "horaInicio" -> "horainicio" = "9:00"
eruda.js:2 🔍 Mapeando header: "horaFin" -> "horafin" = "11:00"
eruda.js:2 🔍 Mapeando header: "ubicación" -> "ubicación" = "Terraza del Sol"
eruda.js:2 🔍 Mapeando header: "latitud" -> "latitud" = "20.97844437"
eruda.js:2 🔍 Mapeando header: "longitud" -> "longitud" = "-89.61172739"
eruda.js:2 🔍 Mapeando header: "capacidad" -> "capacidad" = "20"
eruda.js:2 🔍 Mapeando header: "duración" -> "duración" = "60"
eruda.js:2 🔍 Mapeando header: "precio" -> "precio" = "70"
eruda.js:2 🔍 Mapeando header: "esGratis" -> "esgratis" = "No"
eruda.js:2 💰 Procesando campo gratis: "No"
eruda.js:2 💰 Es gratis: false
eruda.js:2 🔍 Mapeando header: "materiales" -> "materiales" = "Tapetes de yoga, bocinas portátiles, velas decorativas, instructivo visual"
eruda.js:2 🔍 Mapeando header: "requisitos" -> "requisitos" = "Reservar con anticipación, llevar tapete personal, ropa cómoda y ligera"
eruda.js:2 🔍 Mapeando header: "esRecurrente" -> "esrecurrente" = "Sí"
eruda.js:2 🔍 Mapeando header: "diasRecurrentes" -> "diasrecurrentes" = ""
eruda.js:2 🔍 Mapeando header: "mercadoObjetivo" -> "mercadoobjetivo" = "Adultos Mayores"
eruda.js:2 🎯 Mercado objetivo: ["Adultos Mayores"]
eruda.js:2 🔍 Mapeando header: "necesidadesEspeciales" -> "necesidadesespeciales" = ""
eruda.js:2 🔍 Mapeando header: "permiteRegistroPublico" -> "permiteregistropublico" = ""
eruda.js:2 🔍 Mapeando header: "maxRegistros" -> "maxregistros" = ""
eruda.js:2 🔍 Mapeando header: "fechaLimiteRegistro" -> "fechalimiteregistro" = ""
eruda.js:2 🔍 Mapeando header: "instruccionesRegistro" -> "instruccionesregistro" = ""
eruda.js:2 🔍 Mapeando header: "requiereAprobacion" -> "requiereaprobacion" = ""
eruda.js:2 🔍 Mapeando header: "restriccionesEdad" -> "restriccionesedad" = ""
eruda.js:2 🔍 Mapeando header: "requisitosSalud" -> "requisitossalud" = ""
eruda.js:2 📝 Procesando fila 15: 28 valores: (28) ['Torneos de fútbol rápido', 'Torneos de fútbol rápido organizados con equipos locales en canchas del parque.', 'Bosque Los Colomos', 'Deportes y Recreación', '28/09/25', '28/09/25', '10:00', '12:30', 'Cancha Multiusos', '20.70504496', '-103.3902293', '45', '70', '120', 'No', 'Balones de fútbol, conos, redes portátiles, silbatos', 'Participación a partir de doce años, equipo deportivo adecuado, máximo diez equipos', 'Si', '', 'Adolescentes', '', '', '', '', '', '', '', '']
eruda.js:2 ✅ Valores ajustados (28): (28) ['Torneos de fútbol rápido', 'Torneos de fútbol rápido organizados con equipos locales en canchas del parque.', 'Bosque Los Colomos', 'Deportes y Recreación', '28/09/25', '28/09/25', '10:00', '12:30', 'Cancha Multiusos', '20.70504496', '-103.3902293', '45', '70', '120', 'No', 'Balones de fútbol, conos, redes portátiles, silbatos', 'Participación a partir de doce años, equipo deportivo adecuado, máximo diez equipos', 'Si', '', 'Adolescentes', '', '', '', '', '', '', '', '']
eruda.js:2 🔍 Mapeando header: "título" -> "título" = "Torneos de fútbol rápido"
eruda.js:2 🔍 Mapeando header: "descripción" -> "descripción" = "Torneos de fútbol rápido organizados con equipos locales en canchas del parque."
eruda.js:2 🔍 Mapeando header: "parque" -> "parque" = "Bosque Los Colomos"
eruda.js:2 🏞️ Buscando parque: "Bosque Los Colomos"
eruda.js:2 🏞️ Parques disponibles: (19) ['Bosque Los Colomos', 'Bosque de Chapultepec', 'Gran Parque La Plancha', 'Jardín Botánico de Culiacán', 'Parque Bicentenario', 'Parque Central Ciudad Juárez', 'Parque Cultural Higalguense', 'Parque Ecológico Explora', 'Parque Flor del Bosque', 'Parque Fundidora', 'Parque Guanajuato Bicentenario', 'Parque La Mexicana', 'Parque Las Ribieras', 'Parque Metropolitano de Guadalajara', 'Parque Metropolitano de León', 'Parque Rufino Tamayo', 'Parque Tangamanga I', 'Parque el Capitán', 'Sin especificar']
eruda.js:2 ✅ Parque encontrado: Bosque Los Colomos (ID: 99)
eruda.js:2 🔍 Mapeando header: "categoría" -> "categoría" = "Deportes y Recreación"
eruda.js:2 🎨 Buscando categoría: "Deportes y Recreación"
eruda.js:2 🎨 Categorías disponibles: (5) ['Arte y Cultura', 'Naturaleza y Ciencia', 'Deportes y Recreación', 'Comunidad', 'Eventos de Temporada']
eruda.js:2 ✅ Categoría encontrada: Deportes y Recreación (ID: 3)
eruda.js:2 🔍 Mapeando header: "fechaInicio" -> "fechainicio" = "28/09/25"
eruda.js:2 📅 Fecha inicio convertida: "28/09/25" -> "2025-09-28T00:00:00.000Z"
eruda.js:2 🔍 Mapeando header: "fechaFin" -> "fechafin" = "28/09/25"
eruda.js:2 📅 Fecha fin convertida: "28/09/25" -> "2025-09-28T00:00:00.000Z"
eruda.js:2 🔍 Mapeando header: "horaInicio" -> "horainicio" = "10:00"
eruda.js:2 🔍 Mapeando header: "horaFin" -> "horafin" = "12:30"
eruda.js:2 🔍 Mapeando header: "ubicación" -> "ubicación" = "Cancha Multiusos"
eruda.js:2 🔍 Mapeando header: "latitud" -> "latitud" = "20.70504496"
eruda.js:2 🔍 Mapeando header: "longitud" -> "longitud" = "-103.3902293"
eruda.js:2 🔍 Mapeando header: "capacidad" -> "capacidad" = "45"
eruda.js:2 🔍 Mapeando header: "duración" -> "duración" = "70"
eruda.js:2 🔍 Mapeando header: "precio" -> "precio" = "120"
eruda.js:2 🔍 Mapeando header: "esGratis" -> "esgratis" = "No"
eruda.js:2 💰 Procesando campo gratis: "No"
eruda.js:2 💰 Es gratis: false
eruda.js:2 🔍 Mapeando header: "materiales" -> "materiales" = "Balones de fútbol, conos, redes portátiles, silbatos"
eruda.js:2 🔍 Mapeando header: "requisitos" -> "requisitos" = "Participación a partir de doce años, equipo deportivo adecuado, máximo diez equipos"
eruda.js:2 🔍 Mapeando header: "esRecurrente" -> "esrecurrente" = "Si"
eruda.js:2 🔍 Mapeando header: "diasRecurrentes" -> "diasrecurrentes" = ""
eruda.js:2 🔍 Mapeando header: "mercadoObjetivo" -> "mercadoobjetivo" = "Adolescentes"
eruda.js:2 🎯 Mercado objetivo: ["Adolescentes"]
eruda.js:2 🔍 Mapeando header: "necesidadesEspeciales" -> "necesidadesespeciales" = ""
eruda.js:2 🔍 Mapeando header: "permiteRegistroPublico" -> "permiteregistropublico" = ""
eruda.js:2 🔍 Mapeando header: "maxRegistros" -> "maxregistros" = ""
eruda.js:2 🔍 Mapeando header: "fechaLimiteRegistro" -> "fechalimiteregistro" = ""
eruda.js:2 🔍 Mapeando header: "instruccionesRegistro" -> "instruccionesregistro" = ""
eruda.js:2 🔍 Mapeando header: "requiereAprobacion" -> "requiereaprobacion" = ""
eruda.js:2 🔍 Mapeando header: "restriccionesEdad" -> "restriccionesedad" = ""
eruda.js:2 🔍 Mapeando header: "requisitosSalud" -> "requisitossalud" = ""
eruda.js:2 📝 Procesando fila 16: 28 valores: (28) ['Carreras y caminatas recreativas', 'Carreras y caminatas recreativas para todas las edades en senderos señalizados.', 'Parque Las Ribieras', 'Deportes y Recreación', '29/09/25', '29/09/25', '11:00', '14:00', 'Pista Perimetral', '24.82111084', '-107.4005941', '40', '90', '0', 'Si', 'Chalecos numerados, cronómetros, señalética de pista, carpas de hidratación', 'Acceso libre, niños acompañados por adultos, hidratación personal recomendada', 'No', '', 'Adultos', '', '', '', '', '', '', '', '']
eruda.js:2 ✅ Valores ajustados (28): (28) ['Carreras y caminatas recreativas', 'Carreras y caminatas recreativas para todas las edades en senderos señalizados.', 'Parque Las Ribieras', 'Deportes y Recreación', '29/09/25', '29/09/25', '11:00', '14:00', 'Pista Perimetral', '24.82111084', '-107.4005941', '40', '90', '0', 'Si', 'Chalecos numerados, cronómetros, señalética de pista, carpas de hidratación', 'Acceso libre, niños acompañados por adultos, hidratación personal recomendada', 'No', '', 'Adultos', '', '', '', '', '', '', '', '']
eruda.js:2 🔍 Mapeando header: "título" -> "título" = "Carreras y caminatas recreativas"
eruda.js:2 🔍 Mapeando header: "descripción" -> "descripción" = "Carreras y caminatas recreativas para todas las edades en senderos señalizados."
eruda.js:2 🔍 Mapeando header: "parque" -> "parque" = "Parque Las Ribieras"
eruda.js:2 🏞️ Buscando parque: "Parque Las Ribieras"
eruda.js:2 🏞️ Parques disponibles: (19) ['Bosque Los Colomos', 'Bosque de Chapultepec', 'Gran Parque La Plancha', 'Jardín Botánico de Culiacán', 'Parque Bicentenario', 'Parque Central Ciudad Juárez', 'Parque Cultural Higalguense', 'Parque Ecológico Explora', 'Parque Flor del Bosque', 'Parque Fundidora', 'Parque Guanajuato Bicentenario', 'Parque La Mexicana', 'Parque Las Ribieras', 'Parque Metropolitano de Guadalajara', 'Parque Metropolitano de León', 'Parque Rufino Tamayo', 'Parque Tangamanga I', 'Parque el Capitán', 'Sin especificar']
eruda.js:2 ✅ Parque encontrado: Parque Las Ribieras (ID: 101)
eruda.js:2 🔍 Mapeando header: "categoría" -> "categoría" = "Deportes y Recreación"
eruda.js:2 🎨 Buscando categoría: "Deportes y Recreación"
eruda.js:2 🎨 Categorías disponibles: (5) ['Arte y Cultura', 'Naturaleza y Ciencia', 'Deportes y Recreación', 'Comunidad', 'Eventos de Temporada']
eruda.js:2 ✅ Categoría encontrada: Deportes y Recreación (ID: 3)
eruda.js:2 🔍 Mapeando header: "fechaInicio" -> "fechainicio" = "29/09/25"
eruda.js:2 📅 Fecha inicio convertida: "29/09/25" -> "2025-09-29T00:00:00.000Z"
eruda.js:2 🔍 Mapeando header: "fechaFin" -> "fechafin" = "29/09/25"
eruda.js:2 📅 Fecha fin convertida: "29/09/25" -> "2025-09-29T00:00:00.000Z"
eruda.js:2 🔍 Mapeando header: "horaInicio" -> "horainicio" = "11:00"
eruda.js:2 🔍 Mapeando header: "horaFin" -> "horafin" = "14:00"
eruda.js:2 🔍 Mapeando header: "ubicación" -> "ubicación" = "Pista Perimetral"
eruda.js:2 🔍 Mapeando header: "latitud" -> "latitud" = "24.82111084"
eruda.js:2 🔍 Mapeando header: "longitud" -> "longitud" = "-107.4005941"
eruda.js:2 🔍 Mapeando header: "capacidad" -> "capacidad" = "40"
eruda.js:2 🔍 Mapeando header: "duración" -> "duración" = "90"
eruda.js:2 🔍 Mapeando header: "precio" -> "precio" = "0"
eruda.js:2 🔍 Mapeando header: "esGratis" -> "esgratis" = "Si"
eruda.js:2 💰 Procesando campo gratis: "Si"
eruda.js:2 💰 Es gratis: true
eruda.js:2 🔍 Mapeando header: "materiales" -> "materiales" = "Chalecos numerados, cronómetros, señalética de pista, carpas de hidratación"
eruda.js:2 🔍 Mapeando header: "requisitos" -> "requisitos" = "Acceso libre, niños acompañados por adultos, hidratación personal recomendada"
eruda.js:2 🔍 Mapeando header: "esRecurrente" -> "esrecurrente" = "No"
eruda.js:2 🔍 Mapeando header: "diasRecurrentes" -> "diasrecurrentes" = ""
eruda.js:2 🔍 Mapeando header: "mercadoObjetivo" -> "mercadoobjetivo" = "Adultos"
eruda.js:2 🎯 Mercado objetivo: ["Adultos"]
eruda.js:2 🔍 Mapeando header: "necesidadesEspeciales" -> "necesidadesespeciales" = ""
eruda.js:2 🔍 Mapeando header: "permiteRegistroPublico" -> "permiteregistropublico" = ""
eruda.js:2 🔍 Mapeando header: "maxRegistros" -> "maxregistros" = ""
eruda.js:2 🔍 Mapeando header: "fechaLimiteRegistro" -> "fechalimiteregistro" = ""
eruda.js:2 🔍 Mapeando header: "instruccionesRegistro" -> "instruccionesregistro" = ""
eruda.js:2 🔍 Mapeando header: "requiereAprobacion" -> "requiereaprobacion" = ""
eruda.js:2 🔍 Mapeando header: "restriccionesEdad" -> "restriccionesedad" = ""
eruda.js:2 🔍 Mapeando header: "requisitosSalud" -> "requisitossalud" = ""
eruda.js:2 📝 Procesando fila 17: 28 valores: (28) ['Clases de zumba o baile fitness', 'Clases de zumba o baile fitness con música animada y ambiente energético.', 'Jardín Botánico de Culiacán', 'Deportes y Recreación', '30/09/25', '30/09/25', '12:00', '15:30', 'Plaza del Movimiento', '24.82376', '-107.384967', '40', '50', '130', 'No', 'Bocinas, tarima móvil, ropa deportiva, botellas de agua', 'Cupo máximo cincuenta personas, inscripción gratuita, traer ropa deportiva ligera', 'No', '', 'Adultos', '', '', '', '', '', '', '', '']
eruda.js:2 ✅ Valores ajustados (28): (28) ['Clases de zumba o baile fitness', 'Clases de zumba o baile fitness con música animada y ambiente energético.', 'Jardín Botánico de Culiacán', 'Deportes y Recreación', '30/09/25', '30/09/25', '12:00', '15:30', 'Plaza del Movimiento', '24.82376', '-107.384967', '40', '50', '130', 'No', 'Bocinas, tarima móvil, ropa deportiva, botellas de agua', 'Cupo máximo cincuenta personas, inscripción gratuita, traer ropa deportiva ligera', 'No', '', 'Adultos', '', '', '', '', '', '', '', '']
eruda.js:2 🔍 Mapeando header: "título" -> "título" = "Clases de zumba o baile fitness"
eruda.js:2 🔍 Mapeando header: "descripción" -> "descripción" = "Clases de zumba o baile fitness con música animada y ambiente energético."
eruda.js:2 🔍 Mapeando header: "parque" -> "parque" = "Jardín Botánico de Culiacán"
eruda.js:2 🏞️ Buscando parque: "Jardín Botánico de Culiacán"
eruda.js:2 🏞️ Parques disponibles: (19) ['Bosque Los Colomos', 'Bosque de Chapultepec', 'Gran Parque La Plancha', 'Jardín Botánico de Culiacán', 'Parque Bicentenario', 'Parque Central Ciudad Juárez', 'Parque Cultural Higalguense', 'Parque Ecológico Explora', 'Parque Flor del Bosque', 'Parque Fundidora', 'Parque Guanajuato Bicentenario', 'Parque La Mexicana', 'Parque Las Ribieras', 'Parque Metropolitano de Guadalajara', 'Parque Metropolitano de León', 'Parque Rufino Tamayo', 'Parque Tangamanga I', 'Parque el Capitán', 'Sin especificar']
eruda.js:2 ✅ Parque encontrado: Jardín Botánico de Culiacán (ID: 100)
eruda.js:2 🔍 Mapeando header: "categoría" -> "categoría" = "Deportes y Recreación"
eruda.js:2 🎨 Buscando categoría: "Deportes y Recreación"
eruda.js:2 🎨 Categorías disponibles: (5) ['Arte y Cultura', 'Naturaleza y Ciencia', 'Deportes y Recreación', 'Comunidad', 'Eventos de Temporada']
eruda.js:2 ✅ Categoría encontrada: Deportes y Recreación (ID: 3)
eruda.js:2 🔍 Mapeando header: "fechaInicio" -> "fechainicio" = "30/09/25"
eruda.js:2 📅 Fecha inicio convertida: "30/09/25" -> "2025-09-30T00:00:00.000Z"
eruda.js:2 🔍 Mapeando header: "fechaFin" -> "fechafin" = "30/09/25"
eruda.js:2 📅 Fecha fin convertida: "30/09/25" -> "2025-09-30T00:00:00.000Z"
eruda.js:2 🔍 Mapeando header: "horaInicio" -> "horainicio" = "12:00"
eruda.js:2 🔍 Mapeando header: "horaFin" -> "horafin" = "15:30"
eruda.js:2 🔍 Mapeando header: "ubicación" -> "ubicación" = "Plaza del Movimiento"
eruda.js:2 🔍 Mapeando header: "latitud" -> "latitud" = "24.82376"
eruda.js:2 🔍 Mapeando header: "longitud" -> "longitud" = "-107.384967"
eruda.js:2 🔍 Mapeando header: "capacidad" -> "capacidad" = "40"
eruda.js:2 🔍 Mapeando header: "duración" -> "duración" = "50"
eruda.js:2 🔍 Mapeando header: "precio" -> "precio" = "130"
eruda.js:2 🔍 Mapeando header: "esGratis" -> "esgratis" = "No"
eruda.js:2 💰 Procesando campo gratis: "No"
eruda.js:2 💰 Es gratis: false
eruda.js:2 🔍 Mapeando header: "materiales" -> "materiales" = "Bocinas, tarima móvil, ropa deportiva, botellas de agua"
eruda.js:2 🔍 Mapeando header: "requisitos" -> "requisitos" = "Cupo máximo cincuenta personas, inscripción gratuita, traer ropa deportiva ligera"
eruda.js:2 🔍 Mapeando header: "esRecurrente" -> "esrecurrente" = "No"
eruda.js:2 🔍 Mapeando header: "diasRecurrentes" -> "diasrecurrentes" = ""
eruda.js:2 🔍 Mapeando header: "mercadoObjetivo" -> "mercadoobjetivo" = "Adultos"
eruda.js:2 🎯 Mercado objetivo: ["Adultos"]
eruda.js:2 🔍 Mapeando header: "necesidadesEspeciales" -> "necesidadesespeciales" = ""
eruda.js:2 🔍 Mapeando header: "permiteRegistroPublico" -> "permiteregistropublico" = ""
eruda.js:2 🔍 Mapeando header: "maxRegistros" -> "maxregistros" = ""
eruda.js:2 🔍 Mapeando header: "fechaLimiteRegistro" -> "fechalimiteregistro" = ""
eruda.js:2 🔍 Mapeando header: "instruccionesRegistro" -> "instruccionesregistro" = ""
eruda.js:2 🔍 Mapeando header: "requiereAprobacion" -> "requiereaprobacion" = ""
eruda.js:2 🔍 Mapeando header: "restriccionesEdad" -> "restriccionesedad" = ""
eruda.js:2 🔍 Mapeando header: "requisitosSalud" -> "requisitossalud" = ""
eruda.js:2 📝 Procesando fila 18: 28 valores: (28) ['CrossFit o entrenamiento funcional', 'CrossFit o entrenamiento funcional en áreas abiertas con estaciones dinámicas.', 'Parque Flor del Bosque', 'Deportes y Recreación', '01/10/25', '01/10/25', '13:00', '17:00', 'Área de Desafío', '19.0211', '-98.1011', '150', '80', '150', 'No', 'Cajas pliométricas, cuerdas de batalla, llantas recicladas, pesas rusas', 'Inscripción con cuota simbólica, uso obligatorio de calzado adecuado y guantes', 'Si', '', 'Adultos', '', '', '', '', '', '', '', '']
eruda.js:2 ✅ Valores ajustados (28): (28) ['CrossFit o entrenamiento funcional', 'CrossFit o entrenamiento funcional en áreas abiertas con estaciones dinámicas.', 'Parque Flor del Bosque', 'Deportes y Recreación', '01/10/25', '01/10/25', '13:00', '17:00', 'Área de Desafío', '19.0211', '-98.1011', '150', '80', '150', 'No', 'Cajas pliométricas, cuerdas de batalla, llantas recicladas, pesas rusas', 'Inscripción con cuota simbólica, uso obligatorio de calzado adecuado y guantes', 'Si', '', 'Adultos', '', '', '', '', '', '', '', '']
eruda.js:2 🔍 Mapeando header: "título" -> "título" = "CrossFit o entrenamiento funcional"
eruda.js:2 🔍 Mapeando header: "descripción" -> "descripción" = "CrossFit o entrenamiento funcional en áreas abiertas con estaciones dinámicas."
eruda.js:2 🔍 Mapeando header: "parque" -> "parque" = "Parque Flor del Bosque"
eruda.js:2 🏞️ Buscando parque: "Parque Flor del Bosque"
eruda.js:2 🏞️ Parques disponibles: (19) ['Bosque Los Colomos', 'Bosque de Chapultepec', 'Gran Parque La Plancha', 'Jardín Botánico de Culiacán', 'Parque Bicentenario', 'Parque Central Ciudad Juárez', 'Parque Cultural Higalguense', 'Parque Ecológico Explora', 'Parque Flor del Bosque', 'Parque Fundidora', 'Parque Guanajuato Bicentenario', 'Parque La Mexicana', 'Parque Las Ribieras', 'Parque Metropolitano de Guadalajara', 'Parque Metropolitano de León', 'Parque Rufino Tamayo', 'Parque Tangamanga I', 'Parque el Capitán', 'Sin especificar']
eruda.js:2 ✅ Parque encontrado: Parque Flor del Bosque (ID: 103)
eruda.js:2 🔍 Mapeando header: "categoría" -> "categoría" = "Deportes y Recreación"
eruda.js:2 🎨 Buscando categoría: "Deportes y Recreación"
eruda.js:2 🎨 Categorías disponibles: (5) ['Arte y Cultura', 'Naturaleza y Ciencia', 'Deportes y Recreación', 'Comunidad', 'Eventos de Temporada']
eruda.js:2 ✅ Categoría encontrada: Deportes y Recreación (ID: 3)
eruda.js:2 🔍 Mapeando header: "fechaInicio" -> "fechainicio" = "01/10/25"
eruda.js:2 📅 Fecha inicio convertida: "01/10/25" -> "2025-10-01T00:00:00.000Z"
eruda.js:2 🔍 Mapeando header: "fechaFin" -> "fechafin" = "01/10/25"
eruda.js:2 📅 Fecha fin convertida: "01/10/25" -> "2025-10-01T00:00:00.000Z"
eruda.js:2 🔍 Mapeando header: "horaInicio" -> "horainicio" = "13:00"
eruda.js:2 🔍 Mapeando header: "horaFin" -> "horafin" = "17:00"
eruda.js:2 🔍 Mapeando header: "ubicación" -> "ubicación" = "Área de Desafío"
eruda.js:2 🔍 Mapeando header: "latitud" -> "latitud" = "19.0211"
eruda.js:2 🔍 Mapeando header: "longitud" -> "longitud" = "-98.1011"
eruda.js:2 🔍 Mapeando header: "capacidad" -> "capacidad" = "150"
eruda.js:2 🔍 Mapeando header: "duración" -> "duración" = "80"
eruda.js:2 🔍 Mapeando header: "precio" -> "precio" = "150"
eruda.js:2 🔍 Mapeando header: "esGratis" -> "esgratis" = "No"
eruda.js:2 💰 Procesando campo gratis: "No"
eruda.js:2 💰 Es gratis: false
eruda.js:2 🔍 Mapeando header: "materiales" -> "materiales" = "Cajas pliométricas, cuerdas de batalla, llantas recicladas, pesas rusas"
eruda.js:2 🔍 Mapeando header: "requisitos" -> "requisitos" = "Inscripción con cuota simbólica, uso obligatorio de calzado adecuado y guantes"
eruda.js:2 🔍 Mapeando header: "esRecurrente" -> "esrecurrente" = "Si"
eruda.js:2 🔍 Mapeando header: "diasRecurrentes" -> "diasrecurrentes" = ""
eruda.js:2 🔍 Mapeando header: "mercadoObjetivo" -> "mercadoobjetivo" = "Adultos"
eruda.js:2 🎯 Mercado objetivo: ["Adultos"]
eruda.js:2 🔍 Mapeando header: "necesidadesEspeciales" -> "necesidadesespeciales" = ""
eruda.js:2 🔍 Mapeando header: "permiteRegistroPublico" -> "permiteregistropublico" = ""
eruda.js:2 🔍 Mapeando header: "maxRegistros" -> "maxregistros" = ""
eruda.js:2 🔍 Mapeando header: "fechaLimiteRegistro" -> "fechalimiteregistro" = ""
eruda.js:2 🔍 Mapeando header: "instruccionesRegistro" -> "instruccionesregistro" = ""
eruda.js:2 🔍 Mapeando header: "requiereAprobacion" -> "requiereaprobacion" = ""
eruda.js:2 🔍 Mapeando header: "restriccionesEdad" -> "restriccionesedad" = ""
eruda.js:2 🔍 Mapeando header: "requisitosSalud" -> "requisitossalud" = ""
eruda.js:2 📝 Procesando fila 19: 28 valores: (28) ['Renta de bicicletas o patines', 'Renta de bicicletas o patines para recorrer ciclovías y zonas seguras.', 'Parque Cultural Higalguense', 'Deportes y Recreación', '02/10/25', '02/10/25', '14:00', '18:30', 'Estación de Rodadas', '20.09493696', '-98.77239353', '200', '55', '0', 'Si', 'Bicicletas, patines, cascos, chalecos reflectantes', 'Edad mínima diez años, equipo de protección personal obligatorio, uso de casco', 'Si', '', 'Niños', '', '', '', '', '', '', '', '']
eruda.js:2 ✅ Valores ajustados (28): (28) ['Renta de bicicletas o patines', 'Renta de bicicletas o patines para recorrer ciclovías y zonas seguras.', 'Parque Cultural Higalguense', 'Deportes y Recreación', '02/10/25', '02/10/25', '14:00', '18:30', 'Estación de Rodadas', '20.09493696', '-98.77239353', '200', '55', '0', 'Si', 'Bicicletas, patines, cascos, chalecos reflectantes', 'Edad mínima diez años, equipo de protección personal obligatorio, uso de casco', 'Si', '', 'Niños', '', '', '', '', '', '', '', '']
eruda.js:2 🔍 Mapeando header: "título" -> "título" = "Renta de bicicletas o patines"
eruda.js:2 🔍 Mapeando header: "descripción" -> "descripción" = "Renta de bicicletas o patines para recorrer ciclovías y zonas seguras."
eruda.js:2 🔍 Mapeando header: "parque" -> "parque" = "Parque Cultural Higalguense"
eruda.js:2 🏞️ Buscando parque: "Parque Cultural Higalguense"
eruda.js:2 🏞️ Parques disponibles: (19) ['Bosque Los Colomos', 'Bosque de Chapultepec', 'Gran Parque La Plancha', 'Jardín Botánico de Culiacán', 'Parque Bicentenario', 'Parque Central Ciudad Juárez', 'Parque Cultural Higalguense', 'Parque Ecológico Explora', 'Parque Flor del Bosque', 'Parque Fundidora', 'Parque Guanajuato Bicentenario', 'Parque La Mexicana', 'Parque Las Ribieras', 'Parque Metropolitano de Guadalajara', 'Parque Metropolitano de León', 'Parque Rufino Tamayo', 'Parque Tangamanga I', 'Parque el Capitán', 'Sin especificar']
eruda.js:2 ✅ Parque encontrado: Parque Cultural Higalguense (ID: 102)
eruda.js:2 🔍 Mapeando header: "categoría" -> "categoría" = "Deportes y Recreación"
eruda.js:2 🎨 Buscando categoría: "Deportes y Recreación"
eruda.js:2 🎨 Categorías disponibles: (5) ['Arte y Cultura', 'Naturaleza y Ciencia', 'Deportes y Recreación', 'Comunidad', 'Eventos de Temporada']
eruda.js:2 ✅ Categoría encontrada: Deportes y Recreación (ID: 3)
eruda.js:2 🔍 Mapeando header: "fechaInicio" -> "fechainicio" = "02/10/25"
eruda.js:2 📅 Fecha inicio convertida: "02/10/25" -> "2025-10-02T00:00:00.000Z"
eruda.js:2 🔍 Mapeando header: "fechaFin" -> "fechafin" = "02/10/25"
eruda.js:2 📅 Fecha fin convertida: "02/10/25" -> "2025-10-02T00:00:00.000Z"
eruda.js:2 🔍 Mapeando header: "horaInicio" -> "horainicio" = "14:00"
eruda.js:2 🔍 Mapeando header: "horaFin" -> "horafin" = "18:30"
eruda.js:2 🔍 Mapeando header: "ubicación" -> "ubicación" = "Estación de Rodadas"
eruda.js:2 🔍 Mapeando header: "latitud" -> "latitud" = "20.09493696"
eruda.js:2 🔍 Mapeando header: "longitud" -> "longitud" = "-98.77239353"
eruda.js:2 🔍 Mapeando header: "capacidad" -> "capacidad" = "200"
eruda.js:2 🔍 Mapeando header: "duración" -> "duración" = "55"
eruda.js:2 🔍 Mapeando header: "precio" -> "precio" = "0"
eruda.js:2 🔍 Mapeando header: "esGratis" -> "esgratis" = "Si"
eruda.js:2 💰 Procesando campo gratis: "Si"
eruda.js:2 💰 Es gratis: true
eruda.js:2 🔍 Mapeando header: "materiales" -> "materiales" = "Bicicletas, patines, cascos, chalecos reflectantes"
eruda.js:2 🔍 Mapeando header: "requisitos" -> "requisitos" = "Edad mínima diez años, equipo de protección personal obligatorio, uso de casco"
eruda.js:2 🔍 Mapeando header: "esRecurrente" -> "esrecurrente" = "Si"
eruda.js:2 🔍 Mapeando header: "diasRecurrentes" -> "diasrecurrentes" = ""
eruda.js:2 🔍 Mapeando header: "mercadoObjetivo" -> "mercadoobjetivo" = "Niños"
eruda.js:2 🎯 Mercado objetivo: ["Niños"]
eruda.js:2 🔍 Mapeando header: "necesidadesEspeciales" -> "necesidadesespeciales" = ""
eruda.js:2 🔍 Mapeando header: "permiteRegistroPublico" -> "permiteregistropublico" = ""
eruda.js:2 🔍 Mapeando header: "maxRegistros" -> "maxregistros" = ""
eruda.js:2 🔍 Mapeando header: "fechaLimiteRegistro" -> "fechalimiteregistro" = ""
eruda.js:2 🔍 Mapeando header: "instruccionesRegistro" -> "instruccionesregistro" = ""
eruda.js:2 🔍 Mapeando header: "requiereAprobacion" -> "requiereaprobacion" = ""
eruda.js:2 🔍 Mapeando header: "restriccionesEdad" -> "restriccionesedad" = ""
eruda.js:2 🔍 Mapeando header: "requisitosSalud" -> "requisitossalud" = ""
eruda.js:2 📝 Procesando fila 20: 28 valores: (28) ['Rallys de aventura con pruebas físicas y mentales', 'Rallys de aventura con pruebas físicas y mentales para jóvenes equipos.', 'Parque Ecológico Explora', 'Deportes y Recreación', '03/10/25', '03/10/25', '8:00', '9:30', 'Circuito Aventura', '21.1215', '-101.682', '26', '120', '170', 'No', 'Cuerdas, obstáculos inflables, brújulas, cronómetros', 'Participación en equipos de tres a cinco personas, inscripción previa obligatoria', 'Sí', '', 'Adolescentes', '', '', '', '', '', '', '', '']
eruda.js:2 ✅ Valores ajustados (28): (28) ['Rallys de aventura con pruebas físicas y mentales', 'Rallys de aventura con pruebas físicas y mentales para jóvenes equipos.', 'Parque Ecológico Explora', 'Deportes y Recreación', '03/10/25', '03/10/25', '8:00', '9:30', 'Circuito Aventura', '21.1215', '-101.682', '26', '120', '170', 'No', 'Cuerdas, obstáculos inflables, brújulas, cronómetros', 'Participación en equipos de tres a cinco personas, inscripción previa obligatoria', 'Sí', '', 'Adolescentes', '', '', '', '', '', '', '', '']
eruda.js:2 🔍 Mapeando header: "título" -> "título" = "Rallys de aventura con pruebas físicas y mentales"
eruda.js:2 🔍 Mapeando header: "descripción" -> "descripción" = "Rallys de aventura con pruebas físicas y mentales para jóvenes equipos."
eruda.js:2 🔍 Mapeando header: "parque" -> "parque" = "Parque Ecológico Explora"
eruda.js:2 🏞️ Buscando parque: "Parque Ecológico Explora"
eruda.js:2 🏞️ Parques disponibles: (19) ['Bosque Los Colomos', 'Bosque de Chapultepec', 'Gran Parque La Plancha', 'Jardín Botánico de Culiacán', 'Parque Bicentenario', 'Parque Central Ciudad Juárez', 'Parque Cultural Higalguense', 'Parque Ecológico Explora', 'Parque Flor del Bosque', 'Parque Fundidora', 'Parque Guanajuato Bicentenario', 'Parque La Mexicana', 'Parque Las Ribieras', 'Parque Metropolitano de Guadalajara', 'Parque Metropolitano de León', 'Parque Rufino Tamayo', 'Parque Tangamanga I', 'Parque el Capitán', 'Sin especificar']
eruda.js:2 ✅ Parque encontrado: Parque Ecológico Explora (ID: 86)
eruda.js:2 🔍 Mapeando header: "categoría" -> "categoría" = "Deportes y Recreación"
eruda.js:2 🎨 Buscando categoría: "Deportes y Recreación"
eruda.js:2 🎨 Categorías disponibles: (5) ['Arte y Cultura', 'Naturaleza y Ciencia', 'Deportes y Recreación', 'Comunidad', 'Eventos de Temporada']
eruda.js:2 ✅ Categoría encontrada: Deportes y Recreación (ID: 3)
eruda.js:2 🔍 Mapeando header: "fechaInicio" -> "fechainicio" = "03/10/25"
eruda.js:2 📅 Fecha inicio convertida: "03/10/25" -> "2025-10-03T00:00:00.000Z"
eruda.js:2 🔍 Mapeando header: "fechaFin" -> "fechafin" = "03/10/25"
eruda.js:2 📅 Fecha fin convertida: "03/10/25" -> "2025-10-03T00:00:00.000Z"
eruda.js:2 🔍 Mapeando header: "horaInicio" -> "horainicio" = "8:00"
eruda.js:2 🔍 Mapeando header: "horaFin" -> "horafin" = "9:30"
eruda.js:2 🔍 Mapeando header: "ubicación" -> "ubicación" = "Circuito Aventura"
eruda.js:2 🔍 Mapeando header: "latitud" -> "latitud" = "21.1215"
eruda.js:2 🔍 Mapeando header: "longitud" -> "longitud" = "-101.682"
eruda.js:2 🔍 Mapeando header: "capacidad" -> "capacidad" = "26"
eruda.js:2 🔍 Mapeando header: "duración" -> "duración" = "120"
eruda.js:2 🔍 Mapeando header: "precio" -> "precio" = "170"
eruda.js:2 🔍 Mapeando header: "esGratis" -> "esgratis" = "No"
eruda.js:2 💰 Procesando campo gratis: "No"
eruda.js:2 💰 Es gratis: false
eruda.js:2 🔍 Mapeando header: "materiales" -> "materiales" = "Cuerdas, obstáculos inflables, brújulas, cronómetros"
eruda.js:2 🔍 Mapeando header: "requisitos" -> "requisitos" = "Participación en equipos de tres a cinco personas, inscripción previa obligatoria"
eruda.js:2 🔍 Mapeando header: "esRecurrente" -> "esrecurrente" = "Sí"
eruda.js:2 🔍 Mapeando header: "diasRecurrentes" -> "diasrecurrentes" = ""
eruda.js:2 🔍 Mapeando header: "mercadoObjetivo" -> "mercadoobjetivo" = "Adolescentes"
eruda.js:2 🎯 Mercado objetivo: ["Adolescentes"]
eruda.js:2 🔍 Mapeando header: "necesidadesEspeciales" -> "necesidadesespeciales" = ""
eruda.js:2 🔍 Mapeando header: "permiteRegistroPublico" -> "permiteregistropublico" = ""
eruda.js:2 🔍 Mapeando header: "maxRegistros" -> "maxregistros" = ""
eruda.js:2 🔍 Mapeando header: "fechaLimiteRegistro" -> "fechalimiteregistro" = ""
eruda.js:2 🔍 Mapeando header: "instruccionesRegistro" -> "instruccionesregistro" = ""
eruda.js:2 🔍 Mapeando header: "requiereAprobacion" -> "requiereaprobacion" = ""
eruda.js:2 🔍 Mapeando header: "restriccionesEdad" -> "restriccionesedad" = ""
eruda.js:2 🔍 Mapeando header: "requisitosSalud" -> "requisitossalud" = ""
